school_name,unique_id,date,sentences,roberta_compound,place,latitude,longitude,revised_place,revised_latitude,revised_longitude,place_type,false_positive,checked_by
UVA,UVA_9529,2025-10-22 4:53:16,"2 Dawson’s Row, retrieved an axe, and marched back to Alderman.",-0.01452715695,1 Dawson's Row,38.0325,-78.50611,Dawson's Row,38.03278319,-78.50607389,Road,,Kate Dunham
UVA,UVA_12189,2020-09-30 16:17:32,"Found this well-taken care of female beagle running around Grounds, distinctive blue and orange UVA collar, took her to the SPCA.",0.3378522992,Agriculture Grounds,38.88928,-77.03025,University of Virginia,38.0339416,-78.50797184,University,,Kate Dunham
UVA,UVA_11764,2019-09-15 0:19:25,Just UVA students practicing to storm Area 51,-0.009518781677,Air Force Flight Test Center,37.24041,-115.8186,University of Virginia,38.0339416,-78.50797184,University,,Kate Dunham
UVA,UVA_571,2024-05-04 16:47:08,Peace in the Middle East secured,0.0891584754,Al Bank al Brīţānī lish Sharq al Awsaţ,25.2643,55.29326,Middle East,29.8705321,43.03365904,Country,,Kate Dunham
UVA,UVA_4396,2024-02-28 4:22:02,"You wouldn't accept a Jewish state in the Middle East no matter how it was formed, it would be an affront to Allah",-0.8345251083,Al Bank al Brīţānī lish Sharq al Awsaţ,25.2643,55.29326,Middle East,29.8705321,43.03365904,Country,,Kate Dunham
UVA,UVA_8302,2024-05-08 22:16:46,We must forget that they attacked and raped our women and bring peace to the Middle East as it has always been,-0.6861012578,Al Bank al Brīţānī lish Sharq al Awsaţ,25.2643,55.29326,Middle East,29.8705321,43.03365904,Country,,Kate Dunham
UVA,UVA_8862,2023-10-11 2:28:19,So I don’t celebrate the idea that there’s a Jewish homeland in the Middle East.,-0.5636982322,Al Bank al Brīţānī lish Sharq al Awsaţ,25.2643,55.29326,Middle East,29.8705321,43.03365904,Country,,Kate Dunham
UVA,UVA_2178,2024-05-05 22:29:16,These police are decked out like they are deploying to Fallujah.,-0.616071701,Al Fallūjah,33.34913,43.78599,,,,,YES,Kate Dunham
UVA,UVA_11,2025-03-05 18:11:40,or most certainty albemarle county is.,0.004438407719,Albemarle County,38.02289,-78.55654,Albemarle County,38.02615617,-78.55554617,County,,Kate Dunham
UVA,UVA_3515,2020-07-18 9:58:02,"To this point, there is currently a gathering of 100 or so kids and parents at a local baseball field in the western part of Albemarle county, not a mask in sight.",0.01378887054,Albemarle County,38.02289,-78.55654,Albemarle County,38.02615617,-78.55554617,County,,Kate Dunham
UVA,UVA_5161,2025-04-29 16:47:44,It’s like missing the deadline to pay your personal property car tax to Albemarle County and then immediately getting a letter from the IRS.,-0.4712567329,Albemarle County,38.02289,-78.55654,Albemarle County,38.02615617,-78.55554617,County,,Kate Dunham
UVA,UVA_6578,2025-05-23 10:31:49,"Albemarle County, Greene County, and Madison County need to step up law-enforcement big-time on route 29.",0.02534007095,Albemarle County,38.02289,-78.55654,Albemarle County,38.02615617,-78.55554617,County,,Kate Dunham
UVA,UVA_3368,2020-07-18 0:21:16,I heard it’s the smallest out the other houses in Alderman.,-0.01469205227,Alderman,28.49055,-82.16508,Shannon Library,38.03689598,-78.50542731,Building,,Madison Fernandez
UVA,UVA_5033,2019-09-12 17:06:02,Saw this while sitting in Alderman,-0.001544941682,Ålderman,60.23461,21.98375,Shannon Library,38.03689598,-78.50542731,Building,,Madison Fernandez
UVA,UVA_11958,2021-06-03 19:37:53,Theres a plaque in Alderman.,0.004889446311,Ålderman,60.23461,21.98375,Shannon Library,38.03689598,-78.50542731,Building,,Madison Fernandez
UVA,UVA_9024,2019-04-17 15:36:05,Plaque placed in Alderman Library to recognize the birthplace of Reddit,0.002954939147,Alderman Memorial Library,38.03681,-78.50529,Shannon Library,38.03689598,-78.50542731,Building,,Madison Fernandez
UVA,UVA_11964,2021-06-03 21:19:54,i didnt know until I worked at Alderman Library where the plaque was,-0.06400872022,Alderman Memorial Library,38.03681,-78.50529,Shannon Library,38.03689598,-78.50542731,Building,,Madison Fernandez
UVA,UVA_5391,2025-03-02 11:11:10,One security camera picture that looked like the suspect was walking along Alderman Road was posted.,-0.02650997974,Alderman Road Houses,38.03403,-78.5164,Alderman Road,38.03566148,-78.51405515,Road,,Kate Dunham
UVA,UVA_4682,2025-09-15 14:39:29,"My husband and I grew up in NoVA- I went to a better high school than he did (I lived in Fairfax, he in Alexandria/telegraph road), but I went to VCU and he went to UVA.",0.3026016355,Alexandria,38.80484,-77.04692,Virginia Commonwealth University,37.54727774,-77.45431471,University,,Kate Dunham
UVA,UVA_5873,2025-02-27 16:57:36,"ACTIVE ATTACKER NEAR EMMET STREET S UVA Emergency Alert: ACTIVE ATTACKER with knife W/M, red hoodie and blue sweatpants reported in area of 100 Emmet ST S, across from Alumni Hall.",-0.3316815197,Alumni Hall,38.03819,-78.50807,Emmet St South,38.03613143,-78.50798905,Road,,Kate Dunham
UVA,UVA_11275,2021-03-23 15:08:44,"This was way back in 2009, but I got a ticket for going 10 miles over the speed limit down a hill after a series of hills in Amherst.",-0.3273006976,Amherst,42.36723,-72.51852,"Amherst St, VA",38.04286141,-78.48719326,Road,,Madison Fernandez
UVA,UVA_11278,2021-03-23 15:09:28,Can confirm got a ticket in Amherst a while back dude was hiding behind a hill,-0.03239516541,Amherst,42.36723,-72.51852,"Amherst St, VA",38.04286141,-78.48719326,Road,,Madison Fernandez
UVA,UVA_11297,2021-03-23 15:46:52,Kings County near Bakersfield/Fresno halfway between the Bay and LA was like Amherst,0.002031333046,Amherst,42.36723,-72.51852,"Amherst St, VA",38.04286141,-78.48719326,Road,,Madison Fernandez
UVA,UVA_11272,2021-03-23 12:24:06,"About 45-50 minutes south of Charlottesville, you'll cross into Amherst County before getting to Lynchburg.",0.001491884701,Amherst County,37.60477,-79.14511,,37.58428683,-79.05209979,County,,Madison Fernandez
UVA,UVA_11283,2021-03-23 16:27:55,"Great call, the speeding ticket I got in Amherst County for going significantly over the speed limit during third year on the way to North Carolina is proof",0.2345195711,Amherst County,37.60477,-79.14511,,37.58428683,-79.05209979,County,,Madison Fernandez
UVA,UVA_11285,2021-03-23 13:53:30,I used to go to Lynchburg college/family is from Lynchburg and Amherst County is *by far* the biggest speed trap county I've ever experienced in my life.,-0.5112810731,Amherst County,37.60477,-79.14511,,37.58428683,-79.05209979,County,,Madison Fernandez
UVA,UVA_11291,2021-03-23 14:29:36,"This is old data from 2011, but still interesting... >These are the average number of speeding tickets given out per month: > >Amherst County: 394 Lynchburg: 250 Bedford County: 110 Campbell County: 99 Bedford: 97 Appomattox County: 80",0.08298457414,Amherst County,37.60477,-79.14511,,37.58428683,-79.05209979,County,,Madison Fernandez
UVA,UVA_6617,2022-11-14 14:50:29,Wolverine sending love from Ann Arbor,0.8139916658,Ann Arbor,42.27756,-83.74088,,,,City,,Maggie Teweles
UVA,UVA_5710,2025-06-28 13:34:45,"Despite his own Ivy League education, Vance wrote extensively in his book about Appalachia’s disdain for higher education.",-0.1079611406,Appalachia,37.94632,-80.21925,,,,,YES,Maggie Teweles
UVA,UVA_11291,2021-03-23 14:29:36,"This is old data from 2011, but still interesting... >These are the average number of speeding tickets given out per month: > >Amherst County: 394 Lynchburg: 250 Bedford County: 110 Campbell County: 99 Bedford: 97 Appomattox County: 80",0.08298457414,Appomattox County,37.37229,-78.81212,,,,,,
UVA,UVA_2079,2024-05-05 16:28:34,"Do you remember the Munich Olympics (of course you don’t) do you remember the Islamic revolution, did you know its in Iran’s legal code to kill every last Jew in the world and eradicate Israel, did you know that Israel didn’t ask Arabs or Palestinians to leave n 1947 but instead invited them to stay only to be attacked by them, did you know that the 7 day war was started by the Arab nations, did you know that Egypt and Jordan have peace treaties with Israel.",-0.4765244424,Arab Republic of Egypt,27,30,,,,,,
UVA,UVA_5562,2025-10-08 9:35:27,"Alternatively, Innisfree Village in Crozet *might* (no promises) be an option for food and housing... Their IT director might be glad for an intern (but I can't promise it), or you may be able to volunteer in another capacity.",0.3553102612,Archipel des Crozet,-46.41667,51,"Crozet, VA",38.06933895,-78.70043197,City,,Maggie Teweles
UVA,UVA_6732,2019-12-15 8:37:40,I'm confused is the reflection because of the rain or are we just experiencing a mirage like in Arizona,-0.26523453,Arizona,34.5003,-111.50098,,,,State,,Maggie Teweles
UVA,UVA_11075,2022-03-02 19:47:53,"Airbus, All Nippon Airways, the Arizona and Los Angeles governments, Conde Nast (and a slew of publishers), Colgate-Palmolive, Fossil, PwC, Uber, Verizon ... and Google itself, a pretty decent entity.",0.8571702242,Arizona,34.5003,-111.50098,,,,State,false_positive,Maggie Teweles
UVA,UVA_4583,2025-09-12 9:27:17,"Being from NOVA means many different things depending on your specific location (Woodbridge couldn’t be more different from Arlington for instance) your cultural background, your social background, etc.",-0.03118860908,Arlington,32.73569,-97.10807,,,,,,
UVA,UVA_6989,2024-02-27 19:57:57,hey I'm not a UVA student but I actually feel like an Asian advocacy group taking a position on a conflict in Asia is actually pretty normal,0.2812395692,Asia,29.84064,89.29688,,,,,,
UVA,UVA_6991,2024-02-26 16:33:49,If anyone understands how it is to be colonized it’s people from Asia.,-0.2723097801,Asia,29.84064,89.29688,,,,,,
UVA,UVA_7014,2024-02-29 22:17:20,"Surely there are other areas in UVA that represent views that align more with yours, but to have a cultural organization that fails to make a position on a situation or conflict that puts other minorities or marginalized people at risk is to ignore the shared struggles that people of color have faced through the years, that including all of the atrocities pertaining to Asia in the 20th century.",-0.5888633728,Asia,29.84064,89.29688,,,,,,
UVA,UVA_7035,2024-02-26 7:26:53,"Yes, even the ones I’ve met who live in Asia.",0.01809043624,Asia,29.84064,89.29688,,,,,,
UVA,UVA_6607,2022-11-14 11:10:29,Bulldawgs sending love from Athens ❤️,0.9050032496,Athens,37.98376,23.72784,Athens Ohio,39.32838491,-82.10192293,City,,Kayli Blankenship
UVA,UVA_2534,2025-09-26 23:03:31,"Sitting in a hotel bar in Atlanta, watching the game end.",-0.01860553958,Atlanta,33.749,-84.38798,,,,,,
UVA,UVA_6601,2022-11-14 10:31:42,Jackets sending love from Atlanta,0.7002495527,Atlanta,33.749,-84.38798,,,,,,
UVA,UVA_7634,2025-05-10 8:03:07,"Coming from Jersey, I am worried about the “good pizza” comment.",-0.4895578027,Bailiwick of Jersey,49.21667,-2.11667,,,,,,
UVA,UVA_11297,2021-03-23 15:46:52,Kings County near Bakersfield/Fresno halfway between the Bay and LA was like Amherst,0.002031333046,Bakersfield,35.37329,-119.01871,,,,,,
UVA,UVA_10063,2022-11-23 16:45:34,"Hey I'm sending you a message about a Thanksgiving thing :) I'm a Cville local who lives in Baltimore now, but I'd love to connect you with someone!",0.9189090729,Baltimore,39.29038,-76.61219,,,,,,
UVA,UVA_11291,2021-03-23 14:29:36,"This is old data from 2011, but still interesting... >These are the average number of speeding tickets given out per month: > >Amherst County: 394 Lynchburg: 250 Bedford County: 110 Campbell County: 99 Bedford: 97 Appomattox County: 80",0.08298457414,Bedford,38.86116,-86.48721,,,,,,
UVA,UVA_11291,2021-03-23 14:29:36,"This is old data from 2011, but still interesting... >These are the average number of speeding tickets given out per month: > >Amherst County: 394 Lynchburg: 250 Bedford County: 110 Campbell County: 99 Bedford: 97 Appomattox County: 80",0.08298457414,Bedford County,40.00656,-78.49032,,,,,,
UVA,UVA_5750,2025-06-28 11:54:26,"When I recently visited Yarvin’s Craftsman home, in Berkeley, I noticed a painting that Thiel had given him: a portrait of Yarvin in the style of a role-playing-game character card, bearing the legend “Philosopher.” As I sipped tea from a novelty mug featuring an image of Yarvin with a cartoon crown, he told me that it would be “cringe” for him to broadcast his relationship with Thiel—or with Vance, for that matter, whom he met through Thiel around 2015.",-0.008081519045,Berkeley,37.87159,-122.27275,,,,,,
UVA,UVA_7180,2023-11-27 8:30:51,This is pretty close to the Bedlam situation in Oklahoma…,-0.03076786734,Bethlem Royal Hospital,51.38093,-0.02975,,,,,,
UVA,UVA_11572,2020-10-21 11:40:20,Is the Biology building in this the Special Collections library?,-0.00176930835,Biology,29.9867,31.43874,,,,,,
UVA,UVA_77,2025-03-04 18:35:17,All of y'all really do need to read Dr. King's letter from Birmingham Jail.,0.004362593405,Birmingham Police Jail,33.49553,-86.8214,Birmingham Jail,33.49657164,-86.82182728,Building,,Kayli Blankenship
UVA,UVA_645,2022-11-14 19:36:39,I was an alum in Blacksburg in 2007.,0.002162532415,Blacksburg,37.22957,-80.41394,,37.22985802,-80.41706278,,,Madison Fernandez
UVA,UVA_1717,2025-06-27 9:33:31,"As a Hokie, let me say this loudly and clearly to Trump and his cronies in the justice department, and to Youngkin if he doesn't tell them the same: GO FUCK YOURSELF Cville, Blacksburg stands with you.",-0.5435447693,Blacksburg,37.81874,-79.3192,,37.22985802,-80.41706278,,,Madison Fernandez
UVA,UVA_3272,2020-04-02 20:50:19,"Unlike VT, where Blacksburg is literally VT, there is a charlottesville outside of UVA.",-0.02485098317,Blacksburg,37.22957,-80.41394,,37.22985802,-80.41706278,,,Madison Fernandez
UVA,UVA_3607,2022-11-15 13:30:27,Greetings from way behind enemy lines down here in Blacksburg.,0.08234393597,Blacksburg,35.12124,-81.51592,,37.22985802,-80.41706278,,,Madison Fernandez
UVA,UVA_5222,2025-09-27 20:41:59,A student at that school in Blacksburg.,-0.006520782132,Blacksburg,37.81874,-79.3192,,37.22985802,-80.41706278,,,Madison Fernandez
UVA,UVA_5853,2025-05-05 19:39:06,"Couldn’t make it in engineering in Blacksburg, eh?",-0.469312191,Blacksburg,35.12124,-81.51592,,37.22985802,-80.41706278,,,Madison Fernandez
UVA,UVA_10735,2023-12-24 13:13:49,"But seriously, I went from UVA to a life deep behind enemy lines in Blacksburg.",-0.4490649998,Blacksburg,37.22957,-80.41394,,37.22985802,-80.41706278,,,Madison Fernandez
UVA,UVA_11297,2021-03-23 15:46:52,Kings County near Bakersfield/Fresno halfway between the Bay and LA was like Amherst,0.002031333046,Bodega Bay,38.33325,-123.04806,,,,,,
UVA,UVA_9036,2019-04-17 19:07:33,They were in Boston when they came up with it though,0.0005695098662,Boston,42.35843,-71.05977,,,,,,
UVA,UVA_9044,2019-04-17 21:27:42,"As far as I know, they registered while in Boston.",-1.33E-05,Boston,42.35843,-71.05977,,,,,,
UVA,UVA_9046,2019-04-17 21:27:42,Edit: I keep saying Boston but I actually meant Cambridge.,-0.02521410026,Boston,42.35843,-71.05977,,,,,,
UVA,UVA_11014,2025-03-26 14:16:38,The police arrested someone in Boston yesterday for writing an op-ed.,-0.3048106432,Boston,42.35843,-71.05977,,,,,,
UVA,UVA_2750,2020-08-04 12:34:41,Right next to Boylan Heights,0.0150776282,Boylan Heights,35.77571,-78.65084,,,,,,
UVA,UVA_10208,2024-04-26 21:29:52,The 17 society is correct that the Bridge should continue to live and change as the university community does.,0.1152841598,Bridge,51.24513,1.1264,,,,,,
UVA,UVA_10222,2024-04-26 23:01:09,Would you advocate the bridge be a permanent memorial like the football team seems to be acting?,-0.01235825568,Bridge,51.60749,0.0472,,,,,,
UVA,UVA_5871,2020-09-26 23:04:02,When I was in Brown there was a betting pool on when the next truck would can opener itself on it.,0.001355498563,Brown County,44.24217,-94.72748,,,,,,
UVA,UVA_756,2021-05-08 22:32:17,"So far, the exterior areas currently constructed are the Rotunda, The Lawn (Pavilions I-IX and Pavilions II-X), West Range (Dining Hall, Lawn Rooms, and Hotels), the Chapel, Alderman Library, Clemons Library, Special Collections, Peabody Hall, Monroe Hall, Garrett Hall, Cocke Hall, Old Cabell Hall, New Cabell Hall, Rouss Hall, Bryan Hall, and McIntire Amphitheatre.",0.001775119919,Bryan Hall,39.32646,-82.09876,,,,,,
UVA,UVA_849,2024-08-30 15:37:32,"It could be extended to New Cabell, Wilson Hall, Bryan Hall, Nau-Gibson Hall, Minor Hall, The Amphitheatre, Garrett Hall, and more.",0.04462022707,Bryan Hall,39.32646,-82.09876,,,,,,
UVA,UVA_826,2024-08-30 12:40:35,"Extend it out to have the Lawn, Academical Village, Homer Statue, Rouss, Cocke, and Old Cabell.",0.005667147692,Bull Run,29.65354,-90.87371,,,,,,
UVA,UVA_10869,2021-02-24 17:13:30,"Sorry Hoos, it sucks and its awful and prolly doubly so with the weather.",-0.9484117031,Bur Hoos,4.63527,42.96863,,,,,,
UVA,UVA_9759,2025-06-02 14:51:22,"UVA's selectivity will suffer if it can't attract high quality oos students, as Virginia is not populous enough to maintain the same high quality at a high in-state % as a California or a Texas.",-0.5104113221,California,37.25022,-119.75126,,,,,,
UVA,UVA_11296,2021-03-23 15:46:52,Fair; I used to live in CA—in and around LA/SF you weren’t likely to get pulled over (and/or *all traffic* was going 70 in a 50) but just a few miles out of the city centers and your chances increased.,0.08601152897,California,37.25022,-119.75126,,,,,,
UVA,UVA_9046,2019-04-17 21:27:42,Edit: I keep saying Boston but I actually meant Cambridge.,-0.02521410026,Cambridge,52.2,0.11667,,,,,,
UVA,UVA_11286,2021-03-23 13:53:30,You better go the friggen speed limit until you pass into Campbell County.,-0.323174715,Campbell County,36.40351,-84.14938,,,,,,
UVA,UVA_11291,2021-03-23 14:29:36,"This is old data from 2011, but still interesting... >These are the average number of speeding tickets given out per month: > >Amherst County: 394 Lynchburg: 250 Bedford County: 110 Campbell County: 99 Bedford: 97 Appomattox County: 80",0.08298457414,Campbell County,37.20564,-79.09635,,,,,,
UVA,UVA_0,2025-03-05 9:24:52,A legal and acceptable protest on Grounds in Trump’s eyes,-0.01454235148,Capitol Grounds,38.88983,-77.0072,University of Virginia,38.0339416,-78.50797184,University,,Madison Fernandez
UVA,UVA_3280,2020-04-02 20:50:19,** So the corner is our mini downtown area right off of Grounds.,0.002663864288,Capitol Grounds,38.88983,-77.0072,University of Virginia,38.0339416,-78.50797184,University,,Madison Fernandez
UVA,UVA_6622,2025-03-25 18:27:42,"Promoting free expression and free inquiry on Grounds is core to our mission and integral to who we are, and it is not a violation of University policy for a student to walk out of a class, so long as they do so peacefully and without disrupting the class.",0.1503495723,Capitol Grounds,38.88983,-77.0072,University of Virginia,38.0339416,-78.50797184,University,,Madison Fernandez
UVA,UVA_11735,2020-09-10 9:35:12,"We only have two ""classrooms"" on Grounds that fit more than 400 people...when all the seats can be used (Chem and McLeod's auditorium).",0.08197912574,Capitol Grounds,38.88983,-77.0072,University of Virginia,38.0339416,-78.50797184,University,,Madison Fernandez
UVA,UVA_3380,2020-05-24 6:31:47,"Man, CAPS is garbage.",-0.9497488141,Caps,32.37318,-99.84704,,,,,,
UVA,UVA_5386,2025-03-02 11:11:10,"Both incidents started off Grounds, and the only connection to the University in both cases was proximity.",-0.06887470931,Carlisle Grounds,53.2057,-6.10265,University of Virginia,38.0339416,-78.50797184,University,,Madison Fernandez
UVA,UVA_11664,2021-02-17 16:36:34,"Yeah, like it went so well last time tiki torches marched on Grounds...",0.6445757151,Carlisle Grounds,53.2057,-6.10265,University of Virginia,38.0339416,-78.50797184,University,,Madison Fernandez
UVA,UVA_3623,2025-06-27 18:19:28,"If so...Loudspeakers on Carr's Hill, 24-7.",0.01135092042,Carr's Hill,38.03819,-78.5039,,,,,,
UVA,UVA_11403,2025-06-30 7:44:31,"LINK: https://www.nytimes.com/2025/06/30/opinion/university-of-virginia-doj-trump.html *""On Friday, Jim Ryan stood on the lawn of Carr’s Hill, the residence of the president of the University of Virginia, alone in the center of a crowd of supporters.",0.004205754492,Carr's Hill,38.03819,-78.5039,,,,,,
UVA,UVA_5405,2021-03-01 17:38:50,"I should've just rescheduled my appointment, but I decided that instead I would speed walk to CGG and hope that I get there before they close.",-0.01250835694,Casiguran Airport,16.2,122.06667,Charlottesville–Albemarle Airport,38.13936953,-78.45179729,Building,,Madison Fernandez
UVA,UVA_5411,2021-03-01 17:38:50,At this point I'm by clem and I have like 30 seconds to get to CGG.,0.002579676919,Casiguran Airport,16.2,122.06667,Charlottesville–Albemarle Airport,38.13936953,-78.45179729,Building,,Madison Fernandez
UVA,UVA_5416,2021-03-01 17:38:50,But I'm so sweaty from rushing to get to CGG and I can't even take my hoodie off because I'm no wearing anything.,-0.6665626764,Casiguran Airport,16.2,122.06667,Charlottesville–Albemarle Airport,38.13936953,-78.45179729,Building,,Madison Fernandez
UVA,UVA_5441,2021-03-02 10:54:15,"I should've just rescheduled my appointment, but I decided that instead I would speed walk to CGG and hope that I get there before they close.",-0.01250835694,Casiguran Airport,16.2,122.06667,Charlottesville–Albemarle Airport,38.13936953,-78.45179729,Building,,Madison Fernandez
UVA,UVA_5447,2021-03-02 10:54:15,At this point I'm by clem and I have like 30 seconds to get to CGG.,0.002579676919,Casiguran Airport,16.2,122.06667,Charlottesville–Albemarle Airport,38.13936953,-78.45179729,Building,,Madison Fernandez
UVA,UVA_5452,2021-03-02 10:54:15,But I'm so sweaty from rushing to get to CGG and I can't even take my hoodie off because I'm no wearing anything.,-0.6665626764,Casiguran Airport,16.2,122.06667,Charlottesville–Albemarle Airport,38.13936953,-78.45179729,Building,,Madison Fernandez
UVA,UVA_5466,2021-03-02 19:06:51,"I should've just rescheduled my appointment, but I decided that instead I would speed walk to CGG and hope that I get there before they close.",-0.01250835694,Casiguran Airport,16.2,122.06667,Charlottesville–Albemarle Airport,38.13936953,-78.45179729,Building,,Madison Fernandez
UVA,UVA_5472,2021-03-02 19:06:51,At this point I'm by clem and I have like 30 seconds to get to CGG.,0.002579676919,Casiguran Airport,16.2,122.06667,Charlottesville–Albemarle Airport,38.13936953,-78.45179729,Building,,Madison Fernandez
UVA,UVA_5477,2021-03-02 19:06:51,But I'm so sweaty from rushing to get to CGG and I can't even take my hoodie off because I'm no wearing anything.,-0.6665626764,Casiguran Airport,16.2,122.06667,Charlottesville–Albemarle Airport,38.13936953,-78.45179729,Building,,Madison Fernandez
UVA,UVA_12137,2021-04-20 19:04:48,Walked to CGG with a mouthful of saliva 14.,-0.02628158592,Casiguran Airport,16.2,122.06667,Charlottesville–Albemarle Airport,38.13936953,-78.45179729,Building,,Madison Fernandez
UVA,UVA_6756,2021-10-20 11:11:13,The old Castle was much better.,0.297126472,Castle,52.22083,0.10553,,,,,,
UVA,UVA_12035,2021-04-13 16:15:23,Didn't he go on vacation to Cancun while his state was going through worse times than usual?,-0.6041364074,Changchun,43.88,125.32278,,,,,,
UVA,UVA_756,2021-05-08 22:32:17,"So far, the exterior areas currently constructed are the Rotunda, The Lawn (Pavilions I-IX and Pavilions II-X), West Range (Dining Hall, Lawn Rooms, and Hotels), the Chapel, Alderman Library, Clemons Library, Special Collections, Peabody Hall, Monroe Hall, Garrett Hall, Cocke Hall, Old Cabell Hall, New Cabell Hall, Rouss Hall, Bryan Hall, and McIntire Amphitheatre.",0.001775119919,Chapel,30.47104,-83.56987,,,,,,
UVA,UVA_8343,2024-05-04 13:27:14,Chapel area and encampment are completely surrounded by state police in tactical gear,-0.2463345826,Chapel,30.47104,-83.56987,,,,,,
UVA,UVA_756,2021-05-08 22:32:17,"So far, the exterior areas currently constructed are the Rotunda, The Lawn (Pavilions I-IX and Pavilions II-X), West Range (Dining Hall, Lawn Rooms, and Hotels), the Chapel, Alderman Library, Clemons Library, Special Collections, Peabody Hall, Monroe Hall, Garrett Hall, Cocke Hall, Old Cabell Hall, New Cabell Hall, Rouss Hall, Bryan Hall, and McIntire Amphitheatre.",0.001775119919,Charles Broadway Rouss Hall,38.03306,-78.50417,,,,,,
UVA,UVA_639,2022-11-14 12:52:18,UNC Charlotte stands with yall,0.2621345818,Charlotte,35.22709,-80.84313,,,,,,
UVA,UVA_2,2025-03-05 10:58:11,Never forget these motherfuckers came to Charlottesville and killed Heather Heyer.,-0.9406144023,Charlottesville,38.02931,-78.47668,"Charlottesville, VA",38.0299008,-78.4771085,City,,Madison Fernandez
UVA,UVA_616,2022-11-14 10:33:30,Another Hokie sending love to our family in Charlottesville.,0.7580054402,Charlottesville,38.02931,-78.47668,"Charlottesville, VA",38.0299008,-78.4771085,City,,Madison Fernandez
UVA,UVA_629,2022-11-14 11:25:37,It is a dark feeling and I'm sorry it has come to UVA and to Charlottesville again.,-0.8957415223,Charlottesville,38.02931,-78.47668,"Charlottesville, VA",38.0299008,-78.4771085,City,,Madison Fernandez
UVA,UVA_636,2022-11-14 11:09:20,Sending love to you guys in Charlottesville 🧡,0.9175571799,Charlottesville,38.02931,-78.47668,"Charlottesville, VA",38.0299008,-78.4771085,City,,Madison Fernandez
UVA,UVA_661,2022-11-15 0:30:50,"My  goes out to UVA Football, r/UVA, UVA Alumni, r/Charlottesville, once again suffering bright lives lost to tragic violence, now by gunfire.",-0.8561724424,Charlottesville,38.02931,-78.47668,"Charlottesville, VA",38.0299008,-78.4771085,City,,Madison Fernandez
UVA,UVA_1984,2024-05-05 3:41:04,I’ve lived in Charlottesville since November 2000.,-0.004901235923,Charlottesville,38.02931,-78.47668,"Charlottesville, VA",38.0299008,-78.4771085,City,,Madison Fernandez
