school_name,unique_id,date,sentences,roberta_compound,place,latitude,longitude,revised_place,revised_latitude,revised_longitude,place_type,false_positive,checked_by
UVA,UVA_1176,2025-03-28 2:12:27,"The constitution gives all people within the United States certain legal rights and privileges, and just because you are not a citizen does not mean that the government can revoke those rights at any given time, especially not for a legal resident.",-0.03249419481,Territories of the United States,35.27766,-102.35403,USA,40.32101322,-100.9876491,Country,,Madison Fernandez
UVA,UVA_1323,2025-04-07 11:16:11,"It has never been the immigrant or minority communities that have sought to divide the United States, it has always been the establishment seeking to crush change.",-0.4580641985,Territories of the United States,35.27766,-102.35403,USA,40.32101322,-100.9876491,Country,,Madison Fernandez
UVA,UVA_3551,2020-07-16 16:46:12,Kindness and encouragement are actions we do not have the luxury of because we have been trying that ever since the virus reached the United States and we are at three million cases.,-0.07247496396,Territories of the United States,35.27766,-102.35403,USA,40.32101322,-100.9876491,Country,,Madison Fernandez
UVA,UVA_6710,2025-03-26 16:46:57,He wasn’t here illegally but was promoting a terrorist organization as deemed by the United States.,-0.499479115,Territories of the United States,35.27766,-102.35403,USA,40.32101322,-100.9876491,Country,,Madison Fernandez
UVA,UVA_7439,2025-06-27 17:12:23,"Yes, so stop acting in a racist manner - something the United States has struggled with even in the wake of the 1960’s revolution in Black citizen’s autonomy.",-0.5766038895,Territories of the United States,35.27766,-102.35403,USA,40.32101322,-100.9876491,Country,,Madison Fernandez
UVA,UVA_11025,2025-03-26 8:56:39,"There are more than 1,200,000 police officers in the United States so that 11,000 represents less than one percent of police.",-0.1119156033,Territories of the United States,35.27766,-102.35403,USA,40.32101322,-100.9876491,Country,,Madison Fernandez
UVA,UVA_12222,2025-10-23 10:15:06,"“The United States may make such inquiries **as it deems necessary** to verify the accuracy of such certification \[...\] **Nothing in this Agreement prevents the United States**, during the pendency of this Agreement, **from conducting new compliance reviews or investigations or otherwise seeking information related to alleged violations** of Civil Rights Laws arising after the Effective Date.” ""If at any time after the Effective Date, the United States i**n its sole discretion determines that UVA is making insufficient progress toward compliance** with the Civil Rights Laws, it will so notify UVA and **provide UVA with a period of 15 days to make appropriate progress.",-0.05047272891,Territories of the United States,35.27766,-102.35403,USA,40.32101322,-100.9876491,Country,,Madison Fernandez
UVA,UVA_12222,2025-10-23 10:15:06,"“The United States may make such inquiries **as it deems necessary** to verify the accuracy of such certification \[...\] **Nothing in this Agreement prevents the United States**, during the pendency of this Agreement, **from conducting new compliance reviews or investigations or otherwise seeking information related to alleged violations** of Civil Rights Laws arising after the Effective Date.” ""If at any time after the Effective Date, the United States i**n its sole discretion determines that UVA is making insufficient progress toward compliance** with the Civil Rights Laws, it will so notify UVA and **provide UVA with a period of 15 days to make appropriate progress.",-0.05047272891,Territories of the United States,35.27766,-102.35403,USA,40.32101322,-100.9876491,Country,,Madison Fernandez
UVA,UVA_12222,2025-10-23 10:15:06,"“The United States may make such inquiries **as it deems necessary** to verify the accuracy of such certification \[...\] **Nothing in this Agreement prevents the United States**, during the pendency of this Agreement, **from conducting new compliance reviews or investigations or otherwise seeking information related to alleged violations** of Civil Rights Laws arising after the Effective Date.” ""If at any time after the Effective Date, the United States i**n its sole discretion determines that UVA is making insufficient progress toward compliance** with the Civil Rights Laws, it will so notify UVA and **provide UVA with a period of 15 days to make appropriate progress.",-0.05047272891,Territories of the United States,35.27766,-102.35403,USA,40.32101322,-100.9876491,Country,,Madison Fernandez
UVA,UVA_12223,2025-10-23 10:15:06,"** If the United States **determines in its sole discretion after that time that UVA not made adequate progress**, the United States may **terminate this Agreement and may pursue enforcement actions, monetary fines, or grant or funding terminations as appropriate, and may resume all Investigations held in abeyance** during the pendency of this Agreement.""",-0.04758502543,Territories of the United States,35.27766,-102.35403,USA,40.32101322,-100.9876491,Country,,Madison Fernandez
UVA,UVA_12223,2025-10-23 10:15:06,"** If the United States **determines in its sole discretion after that time that UVA not made adequate progress**, the United States may **terminate this Agreement and may pursue enforcement actions, monetary fines, or grant or funding terminations as appropriate, and may resume all Investigations held in abeyance** during the pendency of this Agreement.""",-0.04758502543,Territories of the United States,35.27766,-102.35403,USA,40.32101322,-100.9876491,Country,,Madison Fernandez
UVA,UVA_3909,2025-03-27 8:17:56,The 5th Circuit in Texas went out of their way to make sure a state law banning government contract recipients from criticizing Israel was upheld.,0.02700124308,Texas,31.25044,-99.25061,,,,,,
UVA,UVA_9759,2025-06-02 14:51:22,"UVA's selectivity will suffer if it can't attract high quality oos students, as Virginia is not populous enough to maintain the same high quality at a high in-state % as a California or a Texas.",-0.5104113221,Texas,31.25044,-99.25061,,,,,,
UVA,UVA_2745,2020-08-04 9:07:03,"This 14th street bridge on The Corner is famously known for destroying tall vehicles (trucks, RVs, etc.)",-0.6758843064,The Corner,41.53843,-72.80232,,,,,,
UVA,UVA_5563,2025-10-08 9:35:27,"Also, do you know about The Haven in downtown C-ville?",0.0004244151642,The Haven,53.73444,-6.25472,,,,,,
UVA,UVA_2588,2025-09-27 0:14:34,If it’s any consolation - there were students who weren’t allowed in until halftime because The Hill was full.,-0.2418316752,The Hill,43.07592,-70.75978,,,,,,
UVA,UVA_756,2021-05-08 22:32:17,"So far, the exterior areas currently constructed are the Rotunda, The Lawn (Pavilions I-IX and Pavilions II-X), West Range (Dining Hall, Lawn Rooms, and Hotels), the Chapel, Alderman Library, Clemons Library, Special Collections, Peabody Hall, Monroe Hall, Garrett Hall, Cocke Hall, Old Cabell Hall, New Cabell Hall, Rouss Hall, Bryan Hall, and McIntire Amphitheatre.",0.001775119919,The Lawn,40.91843,-73.78291,,,,,,
UVA,UVA_192,2025-06-28 12:55:55,Hokie here - sending all the love and positivity I have your way.,0.8731948137,The Old Hokie House,41.75511,-70.49781,,,,,,
UVA,UVA_2037,2024-05-04 10:51:31,"From [The DP: ](https://dailyprogress.com/news/local/education/tents-go-up-at-uva-protest/article_9ffdc1c4-09b9-11ef-8eb6-b791db6be31f.html#tracking-source=mp-homepage) *Since the demonstration at UVa began Tuesday, organizers have worked with the university to follow school policies regarding assemblies on Grounds.",0.004244716838,The Park,38.05333,-78.50361,University of Virginia,38.0339416,-78.50797184,University,,Madison Fernandez
UVA,UVA_6620,2025-03-25 18:27:42,"Letter from UVA’s Brie Gertler about tomorrow’s walkout Text of the letter: “Dear members of the faculty and other instructors, It has come to my attention that there has been a call by several organizations for a walkout on central Grounds at 11:30 tomorrow (Wednesday, March 26th), with some students beginning on North Grounds at 11:10.",-0.001327577862,The Park,38.05333,-78.50361,University of Virginia,38.0339416,-78.50797184,University,,Madison Fernandez
UVA,UVA_6620,2025-03-25 18:27:42,"Letter from UVA’s Brie Gertler about tomorrow’s walkout Text of the letter: “Dear members of the faculty and other instructors, It has come to my attention that there has been a call by several organizations for a walkout on central Grounds at 11:30 tomorrow (Wednesday, March 26th), with some students beginning on North Grounds at 11:10.",-0.001327577862,The Park,38.05333,-78.50361,University of Virginia,38.0339416,-78.50797184,University,,Madison Fernandez
UVA,UVA_7689,2020-08-20 19:35:47,"UVa's admitted there's going to be COVID cases, they know that the students aren't going to act responsibility, and they're still opening Grounds (knowing that students are going to want to go) to get money.",-0.1449752897,The Park,38.05333,-78.50361,University of Virginia,38.0339416,-78.50797184,University,,Madison Fernandez
UVA,UVA_7698,2020-08-20 19:25:15,"But the fact is UVa is woefully underprepared for having students back on Grounds, they know it, and they're willing to go through with it anyway just for money",-0.6232568622,The Park,38.05333,-78.50361,University of Virginia,38.0339416,-78.50797184,University,,Madison Fernandez
UVA,UVA_10086,2025-10-08 17:21:45,">Several groups on Grounds have already spoken in opposition of the compact, including the UVA Faculty Senate.",-0.08747445047,The Park,38.05333,-78.50361,University of Virginia,38.0339416,-78.50797184,University,,Madison Fernandez
UVA,UVA_6657,2025-03-25 21:01:58,Well there’s a circus in the White House right now.,-0.3248993754,The White House,38.89761,-77.03637,,,,,,
UVA,UVA_11609,2021-03-03 21:00:32,I'm not sure anything ever truly gets renovated in Thornton.,-0.3682139814,Thornton,35.8823,-84.14797,,,,,,
UVA,UVA_2099,2024-05-06 14:42:48,"Russia’s invasion of Ukraine resulted in at least 82,000 deaths in 2022, Ethiopia — over 104,000 — in that conflict between the national government and regional forces in Tigray",-0.7974073887,Tigray Region,14.16667,38.83333,,,,,,
UVA,UVA_4130,2025-03-26 16:08:09,"Free Palestine, Free Turtle Island, Free those kept in the ICE concentration camps!",-0.4395187795,Turtle Islet,-17.11667,152.00361,,,,,,
UVA,UVA_1302,2025-03-31 22:26:05,Do you believe they deserve to be mistreated and deported for believing that Russia shouldn't be attacking Ukraine?,-0.7030287981,Ukraine,49,32,,,,,,
UVA,UVA_2068,2024-05-05 11:35:24,Aren't we still supporting war for Ukraine tho?,-0.3220861554,Ukraine,49,32,,,,,,
UVA,UVA_2099,2024-05-06 14:42:48,"Russia’s invasion of Ukraine resulted in at least 82,000 deaths in 2022, Ethiopia — over 104,000 — in that conflict between the national government and regional forces in Tigray",-0.7974073887,Ukraine,49,32,,,,,,
UVA,UVA_8046,2021-02-13 11:25:19,Can you get the UK variant even if you’ve had covid before?,-0.01089319587,United Kingdom of Great Britain and Northern Ireland,54.75844,-2.69531,,,,,,
UVA,UVA_8049,2021-02-12 14:43:35,"They didn't tell me if I have the U.K. variant, but wouldn't be surprised.",-0.01029782742,United Kingdom of Great Britain and Northern Ireland,54.75844,-2.69531,,,,,,
UVA,UVA_110,2025-03-04 22:35:59,their parents pay a lot of money for their kids to be educated in the U.S.,-0.2116751671,United States,39.76,-98.5,USA,40.32101322,-100.9876491,Country,,Madison Fernandez
UVA,UVA_176,2025-03-08 13:19:50,"If so, then I hope those on student visas are rapidly deported and those that are U.S. citizens are expelled for fear of losing federal funding.",-0.5313670039,United States,39.76,-98.5,USA,40.32101322,-100.9876491,Country,,Madison Fernandez
UVA,UVA_262,2025-06-28 12:17:47,These are horrible times in the U.S. Our country has ALWAYS had plenty fucked up about it (especially historically) BUT no President has ever been as fucked as the current asscandle!,-0.9282881021,United States,39.76,-98.5,USA,40.32101322,-100.9876491,Country,,Madison Fernandez
UVA,UVA_368,2025-10-06 11:30:24,Our Supreme Leader King of Intimidation Extortion Coercion NDAs Out of Court Settlements God Bless USA,0.107707575,United States,39.76,-98.5,USA,40.32101322,-100.9876491,Country,,Madison Fernandez
UVA,UVA_468,2025-10-04 15:47:24,"But the guys statement is so fire ____________________________________________________ In a statement, Wolff, who said he is a graduate of the U.S.",0.6137924194,United States,39.76,-98.5,,,,,YES,Madison Fernandez
UVA,UVA_590,2024-05-07 7:43:49,Like didn't we do this to the Chinese Irish blacks in America already?,-0.2978818417,United States,39.76,-98.5,USA,40.32101322,-100.9876491,Country,,Madison Fernandez
UVA,UVA_851,2024-08-30 13:11:30,how is US history 101 going ?,-0.01777067035,United States,39.76,-98.5,,,,,YES,Madison Fernandez
UVA,UVA_1195,2025-03-28 9:24:10,Less people who support a terrorist organization that screams death to America and actually killed Americans?,-0.9396148324,United States,39.76,-98.5,USA,40.32101322,-100.9876491,Country,,Madison Fernandez
UVA,UVA_1203,2025-03-31 6:57:14,"If someone leaves their home country to come to the U.S., it's usually for opportunity, safety, education, or freedom.",0.0767377615,United States,39.76,-98.5,USA,40.32101322,-100.9876491,Country,,Kayli Blankenship
UVA,UVA_1206,2025-03-31 6:57:14,"It’s like saying, “America is good enough for me to benefit from, but not good enough for me to respect.” No one’s saying you need to erase your identity or forget your roots.",-0.2948688567,United States,39.76,-98.5,USA,40.32101322,-100.9876491,Country,,Kayli Blankenship
UVA,UVA_1207,2025-03-31 6:57:14,"But when you come to a new country, especially one as diverse and open as the U.S. you have a responsibility to adapt, learn, and live in harmony with others, not to dominate or divide.",0.1667316407,United States,39.76,-98.5,USA,40.32101322,-100.9876491,Country,,Kayli Blankenship
UVA,UVA_1208,2025-03-31 6:57:14,"The U.S. isn't perfect, but it's held together by shared values, not just open borders.",0.1693170667,United States,39.76,-98.5,USA,40.32101322,-100.9876491,Country,,Kayli Blankenship
UVA,UVA_1227,2025-03-28 11:45:49,For the rest of America; it time to grow a backbone bone and stand up against this ridiculousness.,-0.6286947727,United States,39.76,-98.5,USA,40.32101322,-100.9876491,Country,,Kayli Blankenship
UVA,UVA_1244,2025-03-28 10:28:43,I wonder if the current loophole is that the constitution applies to us citizens and since she is not a us citizen then she is not covered by our freedom of speech?,-0.205907166,United States,39.76,-98.5,,40.32101322,-100.9876491,Country,,Madison Fernandez
UVA,UVA_1244,2025-03-28 10:28:43,I wonder if the current loophole is that the constitution applies to us citizens and since she is not a us citizen then she is not covered by our freedom of speech?,-0.205907166,United States,39.76,-98.5,,40.32101322,-100.9876491,Country,,Madison Fernandez
UVA,UVA_1264,2025-04-18 6:42:39,This comment didn’t even make it a month before the administration started letting ICE put U.S. born citizens in detention without any form of due process.,-0.6506985426,United States,39.76,-98.5,,40.32101322,-100.9876491,Country,,Madison Fernandez
UVA,UVA_1298,2025-03-31 22:26:05,"It’s like saying, “America is good enough for me to benefit from, but not good enough for me to respect.” Please explain to me how her advocating for peace in Palestine is ""Disrespectful to American culture.""",-0.665990293,United States,39.76,-98.5,,40.32101322,-100.9876491,Country,,Madison Fernandez
UVA,UVA_1299,2025-03-31 22:26:05,And why exactly do you believe that she has to align with the current US government's stance on foreign politics?,-0.1544484496,United States,39.76,-98.5,,40.32101322,-100.9876491,Country,,Madison Fernandez
UVA,UVA_1303,2025-03-31 22:26:05,Is it really just ideal to you for her to have to act like a perfect robot and agree with every single thing the US government believes in just because she's a guest here?,-0.1021817327,United States,39.76,-98.5,,40.32101322,-100.9876491,Country,,Madison Fernandez
UVA,UVA_1305,2025-03-31 22:26:05,">The U.S. isn't perfect, but it's held together by shared values, not just open borders.",0.147454232,United States,39.76,-98.5,USA,40.32101322,-100.9876491,Country,,Kayli Blankenship
UVA,UVA_1385,2025-06-30 9:59:36,Wake up America!,0.0517591238,United States,39.76,-98.5,USA,40.32101322,-100.9876491,Country,,Kayli Blankenship
UVA,UVA_1686,2025-06-26 20:15:03,Republicans are really making America more and more like China every day.,-0.116077587,United States,39.76,-98.5,,40.32101322,-100.9876491,Country,,Madison Fernandez
UVA,UVA_1742,2025-06-26 22:08:58,Pushing its beliefs on universities across America while accusing the University President of pushing his beliefs on the university.,-0.3528873026,United States,39.76,-98.5,,40.32101322,-100.9876491,Country,,Madison Fernandez
UVA,UVA_1957,2024-05-05 11:14:35,The only exception to that is not betraying the teaching they have had for the last decade of saying America bad.i don’t seen them having that strong of a conviction or loyalty to the ideals so it’s about money.,-0.2240970135,United States,39.76,-98.5,,40.32101322,-100.9876491,Country,,Madison Fernandez
UVA,UVA_2245,2024-05-07 8:36:07,Now it's poor us were the victim.,-0.7791914344,United States,39.76,-98.5,,,,,YES,Madison Fernandez
UVA,UVA_2818,2020-08-27 13:44:50,This is no longer an isolated activity you do on your own time: Every single student in every college across the US is facing this new normal together.,0.03241412342,United States,39.76,-98.5,,40.32101322,-100.9876491,,,
UVA,UVA_3493,2020-07-16 10:45:03,Smh we’re supposed to be some of America’s best students and this is what we do?,-0.1829158515,United States,39.76,-98.5,USA,40.32101322,-100.9876491,Country,,Kayli Blankenship
UVA,UVA_3531,2020-07-16 16:37:49,"People across America have proven that they cannot be trusted to do the right thing, including much of UVA’s student body.",-0.7614854574,United States,39.76,-98.5,,,,,,
UVA,UVA_4195,2025-03-29 9:15:59,Call for the destruction of the West and America as well as the jews….,-0.694165051,United States,39.76,-98.5,,,,,,
UVA,UVA_4456,2024-02-27 7:30:52,&#x200B; I suspect you're the kind that complains about the unfairness of the US economy while knowingly choosing a useless major?,-0.879879415,United States,39.76,-98.5,,,,,,
UVA,UVA_4459,2024-02-28 17:23:00,"im sorry but gaza should not be a big issues in america, if we cut all funding to israel, even non military they lose less than 10 percent of their military budget.",-0.6483291984,United States,39.76,-98.5,,,,,,
UVA,UVA_4639,2025-09-12 6:59:16,"I always assumed it had to do with proximity to the most bland yet self-important metropolis in the US, the resultant insecurity that breeds, actively rewarding passive-aggression as virtuous, and dedication to redefining mediocrity as intelligence.",-0.4079350829,United States,39.76,-98.5,,,,,,
UVA,UVA_4706,2025-09-15 23:14:10,"2 sons and a daughter all graduated from UVA from Va. Beach and remain dear friends with not only their NOVA friends, but also those from many other parts of VA, as well as other parts of the US and some international, too.",0.5899528265,United States,39.76,-98.5,,,,,,
UVA,UVA_5146,2025-04-29 16:43:34,"Looks like it's from Harmeet K. Dhillon assistant AG, Gregory W. Brown the deputy assistant AG and Jeffrey Morrison, senior counsel for civil rights devision at US DOJ",0.00210744678,United States,39.76,-98.5,,,,,,
UVA,UVA_5613,2025-10-10 22:51:11,Join the US military.,-0.01759392209,United States,39.76,-98.5,,,,,YES,Kayli Blankenship
UVA,UVA_5721,2025-06-28 12:17:03,"In 2021, JD Vance also called for the ""de-Baathification"" of America's public institutions, referring to the policy of purging the Ba'ath Party's influence after the invasion of Iraq and toppling of Saddam Hussein - *""We should seize the institutions of the left and turn them against the left.",-0.1019558758,United States,39.76,-98.5,,,,,,
UVA,UVA_5747,2025-06-28 11:54:26,"Instead, he has become one of America’s most influential illiberal thinkers, an engineer of the intellectual source code for the second Trump Administration.",0.0933766067,United States,39.76,-98.5,,,,,,
UVA,UVA_6455,2020-11-02 18:40:52,"Luckily, most young people aren't spoiled little babies, who give back for the great life america afforded them instead of reeeeeeeeing about himself and his life.",0.2440171838,United States,39.76,-98.5,,,,,,
UVA,UVA_6460,2020-11-02 18:40:52,You don't seem to like a lot about america even though your man in office (not for long).,-0.7742424011,United States,39.76,-98.5,USA,40.32101322,-100.9876491,Country,,Kayli Blankenship
UVA,UVA_6714,2025-03-26 20:12:39,They legally immigrated to the US.,-0.01762268879,United States,39.76,-98.5,USA,40.32101322,-100.9876491,Country,,Kayli Blankenship
UVA,UVA_6715,2025-03-26 20:12:39,I asked him one day what he liked best about being in the US.,0.003548377426,United States,39.76,-98.5,USA,40.32101322,-100.9876491,Country,,Kayli Blankenship
UVA,UVA_6918,2021-03-22 20:48:38,"I can bring proof of ""residency"" with my lease and UVa ID, but I don't have a US ID.",-0.1270696074,United States,39.76,-98.5,USA,40.32101322,-100.9876491,Country,,Madison Fernandez
UVA,UVA_6968,2024-02-26 4:10:09,"See their full statement they made on their Instagram here: ""Violence towards Asians and Asian Americans in this present moment can, in no way, be separated from the long histories of U.S. militarism, imperialism, and racial capitalism.",-0.42918697,United States,39.76,-98.5,USA,40.32101322,-100.9876491,Country,,Madison Fernandez
UVA,UVA_6975,2024-02-26 4:10:09,"As a Chinese-American who is joining the National Guard with 2 other Asian friends who are joining the Navy ROTC, I strongly disagree with the critiques levied against US militarism.",-0.4373940825,United States,39.76,-98.5,USA,40.32101322,-100.9876491,Country,,Madison Fernandez
UVA,UVA_6982,2024-02-26 9:32:08,Their instagram bio calls for “collective liberation” - they aren’t gonna be promoting the US military with that mission statement,-0.3546290696,United States,39.76,-98.5,USA,40.32101322,-100.9876491,Country,,Madison Fernandez
UVA,UVA_7003,2024-02-26 23:26:11,"as a chinese who's grandma suffered during the cultural revolution and who's dad immigrated to the US after being mistreated by the chinese govt, i had to laugh.",-0.3771472275,United States,39.76,-98.5,USA,40.32101322,-100.9876491,Country,,Madison Fernandez
UVA,UVA_7007,2024-02-26 11:27:54,"Also I believe the US shouldn't be soft with CCP or Russia, which this ASU organization clearly advocate for.",-0.2270274013,United States,39.76,-98.5,USA,40.32101322,-100.9876491,Country,,Madison Fernandez
UVA,UVA_7009,2024-02-26 11:27:54,Any organization that undermines the democratic principles of America shouldn't be tolerated at campus,-0.8847130537,United States,39.76,-98.5,USA,40.32101322,-100.9876491,Country,,Madison Fernandez
UVA,UVA_7017,2024-02-29 22:17:20,"You seem to be more closely connected to the US military, so it would make sense that you aren't too happy to hear that ASU is protesting against the genocidal acts of a US ally, but I am surprised that you are resistant to the claims to Sinophobia regarding the American stance towards China.",-0.478666544,United States,39.76,-98.5,USA,40.32101322,-100.9876491,Country,,Madison Fernandez
UVA,UVA_7017,2024-02-29 22:17:20,"You seem to be more closely connected to the US military, so it would make sense that you aren't too happy to hear that ASU is protesting against the genocidal acts of a US ally, but I am surprised that you are resistant to the claims to Sinophobia regarding the American stance towards China.",-0.478666544,United States,39.76,-98.5,USA,40.32101322,-100.9876491,Country,,Madison Fernandez
UVA,UVA_7021,2024-02-29 22:17:20,"But taking a step back and looking at the big picture, I think as Asians in America we can appreciate other non-Asian Americans supporting Stop Asian Hate and standing in solidarity with Asian people.",0.2333723307,United States,39.76,-98.5,USA,40.32101322,-100.9876491,Country,,Madison Fernandez
UVA,UVA_7034,2024-02-26 7:26:53,"ASU is off the rails They defended affirmative action even though Harvard as known to have used it to discriminate against Asians by rating them lower in personality scores Also, most Asians I know are generally supportive of the US.",-0.225074321,United States,39.76,-98.5,USA,40.32101322,-100.9876491,Country,,Madison Fernandez
UVA,UVA_7037,2024-02-26 7:26:53,"I really don’t think their support of China is anything beyond “Asian = good and any criticism is racism.” It’s a silly and reductive argument, especially when China is guilty of many of the criticisms that they say the US has.",-0.6623820066,United States,39.76,-98.5,USA,40.32101322,-100.9876491,Country,,Madison Fernandez
UVA,UVA_7044,2024-02-26 14:07:10,"Due to then having a lot of leftist who also conflate being Anti-American with being pro-other Anti-American countries which results in support of countries who are legitimately much worse, but they're seen as opponents of America making them seem good to support.",-0.5324841142,United States,39.76,-98.5,USA,40.32101322,-100.9876491,Country,,Madison Fernandez
UVA,UVA_7045,2024-02-26 14:07:10,"This makes a really dangerous dichotomy that ends up with leftist enabling/supporting/defending/excusing/etc things they accuse America of, or worse.",-0.91885221,United States,39.76,-98.5,USA,40.32101322,-100.9876491,Country,,Madison Fernandez
