school_name,unique_id,date,sentences,roberta_compound,place,latitude,longitude,revised_place,revised_latitude,revised_longitude,place_type,false_positive,checked_by
UVA,UVA_6165,2021-03-22 22:48:33,tell them to pull up then /s but no fr the people who run the danville clinic told people to show up bc they’ve been throwing out vaccines every day.,-0.6716972589,Danville,36.58597,-79.39502,325 Piedmont Drive,36.5946367,-79.42153453,Building,,Madison Fernandez
UVA,UVA_6168,2021-03-23 3:18:11,"They are all in Danville, VA, because they are trying to get a vaccine.",-0.0811721608,Danville,36.58597,-79.39502,325 Piedmont Drive,36.5946367,-79.42153453,Building,,Madison Fernandez
UVA,UVA_6169,2021-03-23 3:18:11,"The Danville pharmacies have been throwing out a lot of vaccine doses that are no longer viable, so they asked people in surrounding areas to please come sign up and use those otherwise wasted doses.",-0.4407404959,Danville,36.58597,-79.39502,325 Piedmont Drive,36.5946367,-79.42153453,Building,,Madison Fernandez
UVA,UVA_6171,2021-03-23 8:56:48,"They are all in Danville, VA, because they are trying to get a vaccine.",-0.0811721608,Danville,36.58597,-79.39502,325 Piedmont Drive,36.5946367,-79.42153453,Building,,Madison Fernandez
UVA,UVA_6172,2021-03-23 8:56:48,The Danville pharmacies have been throwing out a lot of vaccine doses that are no longer via Where online are the pharmacies asking people to sign up?,-0.6296779513,Danville,36.58597,-79.39502,325 Piedmont Drive,36.5946367,-79.42153453,Building,,Madison Fernandez
UVA,UVA_6845,2021-03-22 15:41:53,DANVILLE VACCINATIONS - The clinic has excess Moderna vaccines so they are giving out vaccines for walk-ins for the next 90 days.,-0.08644068986,Danville,40.96342,-76.61273,325 Piedmont Drive,36.5946367,-79.42153453,Building,,Madison Fernandez
UVA,UVA_6850,2021-03-22 15:41:53,"- Address: 325 Piedmont Drive, Danville, VA, 24540 OR 499 Mall Drive, Danville, VA, 24540 -- JCPenney entrance",0.001386664924,Danville,36.58597,-79.39502,325 Piedmont Drive,36.5946367,-79.42153453,Building,,Madison Fernandez
UVA,UVA_6850,2021-03-22 15:41:53,"- Address: 325 Piedmont Drive, Danville, VA, 24540 OR 499 Mall Drive, Danville, VA, 24540 -- JCPenney entrance",0.001386664924,Danville,36.58597,-79.39502,325 Piedmont Drive,36.5946367,-79.42153453,Building,,Madison Fernandez
UVA,UVA_6872,2021-03-23 9:10:38,Which CVS in Danville was doing it?,6.79E-06,Danville,36.58597,-79.39502,325 Piedmont Drive,36.5946367,-79.42153453,Building,,Madison Fernandez
UVA,UVA_6888,2021-03-22 15:42:07,DANVILLE VACCINATIONS - The clinic has excess Moderna vaccines so they are giving out vaccines for walk-ins for the next 90 days.,-0.08644068986,Danville,40.96342,-76.61273,325 Piedmont Drive,36.5946367,-79.42153453,Building,,Madison Fernandez
UVA,UVA_6893,2021-03-22 15:42:07,"- Address: 325 Piedmont Drive, Danville, VA, 24540 OR 499 Mall Drive, Danville, VA, 24540 -- JCPenney entrance",0.001386664924,Danville,36.58597,-79.39502,325 Piedmont Drive,36.5946367,-79.42153453,Building,,Madison Fernandez
UVA,UVA_6893,2021-03-22 15:42:07,"- Address: 325 Piedmont Drive, Danville, VA, 24540 OR 499 Mall Drive, Danville, VA, 24540 -- JCPenney entrance",0.001386664924,Danville,36.58597,-79.39502,325 Piedmont Drive,36.5946367,-79.42153453,Building,,Madison Fernandez
UVA,UVA_11271,2021-03-23 12:24:06,29 because they want to go to the Danville vaccine clinic.,-0.004536519293,Danville,36.58597,-79.39502,325 Piedmont Drive,36.5946367,-79.42153453,Building,,Madison Fernandez
UVA,UVA_3096,2020-04-02 20:50:19,"Look, I lived in Dillard two years in a row.",-0.01759614982,Dillard,31.51767,-85.69494,,,,,,
UVA,UVA_867,2025-10-17 16:39:05,"Paul Mahoney Interim President University of Virginia _ _ October 17, 2025 The United States Department of Education Washington, DC 20202 Dear Secretary McMahon, Ms. Mailman, and Mr. Haley, Thank you for your letter inviting comment on the proposed Compact for Academic Excellence in Higher Education.",0.3205469251,District of Columbia,38.91706,-77.00025,District of Columbia,38.91706,-77.00025,City,,Madison Fernandez
UVA,UVA_1966,2024-05-05 14:02:48,They students WERE nonviolent and were willing to be arrested (like anti war protestors currently are all the time in DC).,-0.2981754243,District of Columbia,38.91706,-77.00025,District of Columbia,38.91706,-77.00025,City,,Madison Fernandez
UVA,UVA_2247,2024-05-07 11:26:57,They should have been in DC on January 6th.,-0.03216779977,District of Columbia,38.91706,-77.00025,District of Columbia,38.91706,-77.00025,City,,Madison Fernandez
UVA,UVA_4625,2025-09-14 23:07:07,Moving back to NoVA and D.C.,0.001472585602,District of Columbia,38.91706,-77.00025,District of Columbia,38.91706,-77.00025,City,,Madison Fernandez
UVA,UVA_7719,2025-04-30 18:35:17,"6)A job that pays $18/hr in the DC area is essentially a small stipend, not a liveable wage.",-0.2229245156,District of Columbia,38.91706,-77.00025,District of Columbia,38.91706,-77.00025,City,,Madison Fernandez
UVA,UVA_7788,2025-04-30 23:47:33,Uh…my company is hiring a ton of people in the suburbs of DC.,0.03025087714,District of Columbia,38.91706,-77.00025,District of Columbia,38.91706,-77.00025,City,,Madison Fernandez
UVA,UVA_7937,2025-02-19 22:07:36,Every DC / nova based federal job interview was miserable and boring.,-0.9428291321,District of Columbia,38.91706,-77.00025,District of Columbia,38.91706,-77.00025,City,,Madison Fernandez
UVA,UVA_9163,2025-02-08 11:39:37,It is a 2 1/2 hour drive from Charlottesville to D.C. What doing with your weekends that is more important than this?,-0.1507992446,District of Columbia,38.91706,-77.00025,District of Columbia,38.91706,-77.00025,City,,Madison Fernandez
UVA,UVA_10640,2023-12-24 12:01:26,"Honestly, UVA was my only choice (which I was very privileged to have) but I just don’t think a college town environment not near any major cities like NYC or DC (like less then an hour) works very well for me.",-0.3781102896,District of Columbia,38.91706,-77.00025,District of Columbia,38.91706,-77.00025,City,,Madison Fernandez
UVA,UVA_10728,2023-12-24 19:28:29,i miss my home city (not as big as NYC or DC but still) and i’m not a big partier.,-0.5960652232,District of Columbia,38.91706,-77.00025,District of Columbia,38.91706,-77.00025,City,,Madison Fernandez
UVA,UVA_11287,2021-03-23 16:29:31,I got a ticket for going 7 over in between DC and Charlottesville after a job interview.,-0.1300402135,District of Columbia,38.91706,-77.00025,District of Columbia,38.91706,-77.00025,City,,Madison Fernandez
UVA,UVA_12171,2021-03-15 7:36:42,I went to DC for my Spring Break as a professor.,0.02257852815,District of Columbia,38.91706,-77.00025,District of Columbia,38.91706,-77.00025,City,,Madison Fernandez
UVA,UVA_12319,2025-10-23 10:54:16,"I don't think anything bad that happens is so much his fault as it is of the Board (who started us down the whole road of capitulation), Youngkin/Miyares, and of course the combo circus ringleaders/circus performers who are in charge in D.C.",-0.09176739305,District of Columbia,38.91706,-77.00025,District of Columbia,38.91706,-77.00025,City,,Madison Fernandez
UVA,UVA_5736,2025-06-28 11:54:26,"* [https://www.newyorker.com/magazine/2025/06/09/curtis-yarvin-profile](https://www.newyorker.com/magazine/2025/06/09/curtis-yarvin-profile) Yarvin proposes that nations should eventually be broken up into a “patchwork” of statelets, like Singapore or Dubai, each with its own sovereign ruler.",-0.01487353072,Dubai,25.07725,55.30927,,,,,,
UVA,UVA_6610,2022-11-14 11:41:51,Sending good vibes and love from Durham and Duke.,0.9068918824,Durham,35.99403,-78.89862,,,,,,
UVA,UVA_798,2021-05-08 23:02:51,"No need to pay, I added the world zip file in the comments for y'all!",0.233095482,Earth,0,0,,,,,YES,Kayli Blankenship
UVA,UVA_2004,2024-05-04 22:37:55,Take back the Earth.,0.01399893686,Earth,0,0,,,,,YES,Kayli Blankenship
UVA,UVA_10263,2025-10-02 23:16:35,Timothy Snyder is a historian of Eastern Europe in the 20th century who has written exhaustively and persuasively on the parallels.,0.08730754256,Eastern Europe,51.72703,28.38867,,,,,,
UVA,UVA_10427,2023-04-25 16:12:11,Demolition of the very old hotel/motel across from EIG.,-0.01568999514,Eik,58.1,7.8,,,,,,
UVA,UVA_4228,2019-04-09 23:07:54,Tech had a hell of a run but in El Paso we’re glad to hold on to the distinction for another year and we salute you!,0.9483072162,El Paso,31.75872,-106.48693,,,,,,
UVA,UVA_2474,2023-11-29 0:19:40,Girl coming to visit me got arm broken on Rugby Road.,-0.6028886437,Elgin,36.3323,-84.60633,,,,,,
UVA,UVA_1320,2025-04-07 11:16:11,"The United States is not a country with ""guests"" unless they want to be guests.",-0.3924789131,Embassy of the United States,-35.30653,149.11623,,,,,,
UVA,UVA_4058,2022-09-08 15:14:29,"[The Royal Visit](https://uvamagazine.org/articles/a_royal_visit) In 1976, Queen Elizabeth II visited several cities in the United States to commemorate the nation’s bicentennial.",0.0761982277,Embassy of the United States,-35.30653,149.11623,,,,,,
UVA,UVA_6610,2022-11-14 11:41:51,Sending good vibes and love from Durham and Duke.,0.9068918824,Erwin,35.32683,-78.67613,,,,,,
UVA,UVA_9862,2025-01-28 6:29:47,"F. A. Walke Norfolk, Va. June 26th, 1851 Why not experiment and then make judgement?",-0.007465169299,Estación Va. Calzada,-34.79668,-58.35914,,,,,,
UVA,UVA_11776,2025-05-03 20:58:13,"Curious if others are also planning on moving to Europe for grad school, research opportunities, etc.",0.01234630495,Europe,48.69096,9.14062,Europe,57.14482995,14.52243987,Country,,Kayli Blankenship
UVA,UVA_7507,2021-10-27 15:31:03,All of the faculty and staff are already on 365 and have been for years.,0.02751164325,Exit 365,37.11917,-121.62611,,,,,,
UVA,UVA_4682,2025-09-15 14:39:29,"My husband and I grew up in NoVA- I went to a better high school than he did (I lived in Fairfax, he in Alexandria/telegraph road), but I went to VCU and he went to UVA.",0.3026016355,Fairfax,38.84622,-77.30637,,,,,,
UVA,UVA_4547,2025-09-11 23:51:00,"for context I was born & raised in RVA, and I love my city most for it's friendly/laid back/cool inhabitants.",0.9781341553,Farafangana,-22.82223,47.82615,Richmond,37.54098827,-77.44013222,City,,Kayli Blankenship
UVA,UVA_2082,2024-05-05 16:28:34,Why aren’t people protesting what’s happening in Somalia or Ethiopia.,-0.5485724807,Federal Democratic Republic of Ethiopia,9,39.5,,,,,,
UVA,UVA_2099,2024-05-06 14:42:48,"Russia’s invasion of Ukraine resulted in at least 82,000 deaths in 2022, Ethiopia — over 104,000 — in that conflict between the national government and regional forces in Tigray",-0.7974073887,Federal Democratic Republic of Ethiopia,9,39.5,,,,,,
UVA,UVA_937,2025-10-18 12:36:00,"When I graduated UVA Med ‘86, giving sex hormones and performing genitalia surgery was considered comparable to Nazi Germany’s experiments testing drugs and procedures on Jews and homosexuals.",-0.3908530772,Federal Republic of Germany,51.5,10.5,,,,,,
UVA,UVA_1322,2025-04-07 11:16:11,"We are not Germany, you will never be a gasterbeiter for years.",-0.5042563677,Federal Republic of Germany,51.5,10.5,Germany,51.0567043,10.46794271,Country,,Kayli Blankenship
UVA,UVA_10311,2025-10-03 10:12:49,"Also, prior to 1918 Germany had a constitutional monarchy.",-0.0334928073,Federal Republic of Germany,51.5,10.5,Germany,51.0567043,10.46794271,Country,,Kayli Blankenship
UVA,UVA_11017,2025-03-26 9:54:54,I was assaulted outside Fitzroy one night at 2AM.,-0.7818479538,Fitzroy,51.5235,-0.1402,The Fitzroy,38.0305214,-78.48092753,Building,,Lilia Edwards
UVA,UVA_146,2025-03-06 19:18:12,At least in Florida the Governor appoints every college board member.,0.01155942306,Florida,28.75054,-82.5001,Florida,28.75054,-82.5001,State,,Lilia Edwards
UVA,UVA_148,2025-03-06 19:18:12,"There are a few colleges in Florida where the Governor pretty much said, ""I want this person as your college president.",0.0111940885,Florida,28.75054,-82.5001,Florida,28.75054,-82.5001,State,,Lilia Edwards
UVA,UVA_3621,2025-06-27 16:35:58,“We couldn’t do a national search and leave both positions unfilled for that long.” See what the utterly unqualified Ben Sasse did to the university of Florida.,-0.7138419747,Florida,28.75054,-82.5001,Florida,28.75054,-82.5001,State,,Lilia Edwards
UVA,UVA_5224,2025-09-27 20:49:27,I’m not a Virginia tech fan or a Florida state fan,-0.2137820423,Florida,28.75054,-82.5001,Florida,28.75054,-82.5001,State,,Lilia Edwards
UVA,UVA_10128,2025-10-11 21:32:38,New College of Florida was completely gutted and turned into a far right Christian university by the government of Florida.,-0.7058044076,Florida,28.75054,-82.5001,Florida,28.75054,-82.5001,State,,Lilia Edwards
UVA,UVA_7324,2024-03-13 6:48:58,Go check out the center median at Hydraulic and 250.,-0.002464851132,Frederikssund Kommune,55.80957,12.04038,US-250 & Hydraulic Rd,38.05680547,-78.4894555,Road,,Lilia Edwards
UVA,UVA_2658,2025-09-28 2:14:13,"all this just to lose to louisville next week, lmao",-0.3913299441,Gansville,32.13544,-92.73432,University of Louisville,38.21580235,-85.76157973,University,,Lilia Edwards
UVA,UVA_756,2021-05-08 22:32:17,"So far, the exterior areas currently constructed are the Rotunda, The Lawn (Pavilions I-IX and Pavilions II-X), West Range (Dining Hall, Lawn Rooms, and Hotels), the Chapel, Alderman Library, Clemons Library, Special Collections, Peabody Hall, Monroe Hall, Garrett Hall, Cocke Hall, Old Cabell Hall, New Cabell Hall, Rouss Hall, Bryan Hall, and McIntire Amphitheatre.",0.001775119919,Garrett Hall,40.32391,-75.73552,Garret Hall,38.03471397,-78.50513519,Building,,Lilia Edwards
UVA,UVA_849,2024-08-30 15:37:32,"It could be extended to New Cabell, Wilson Hall, Bryan Hall, Nau-Gibson Hall, Minor Hall, The Amphitheatre, Garrett Hall, and more.",0.04462022707,Garrett Hall,40.69754,-89.61288,Garret Hall,38.03471397,-78.50513519,Building,,Lilia Edwards
UVA,UVA_505,2024-05-04 16:24:04,"Cav Daily video: riot police break up UVA encampment for Gaza with pepper spray, batons and shields",-0.4264312088,Gaza,31.50161,34.46672,Gaza,31.50161,34.46672,City,,Lilia Edwards
UVA,UVA_554,2024-05-05 15:50:18,Privileged idiots I wish they can send them all to gaza to support Hamas there.,-0.8620319963,Gaza,31.50161,34.46672,Gaza,31.50161,34.46672,City,,Lilia Edwards
UVA,UVA_1199,2025-03-30 15:03:18,She should go to Gaza and protest there.,-0.2202230692,Gaza,31.50161,34.46672,Gaza,31.50161,34.46672,City,,Lilia Edwards
UVA,UVA_2111,2024-05-04 15:40:34,Let's all chip in to send them to Gaza to fight for them,0.02167363279,Gaza,31.50161,34.46672,Gaza,31.50161,34.46672,City,,Lilia Edwards
UVA,UVA_4101,2025-03-26 10:49:35,show your support for the anti-Hamas Palestinians protesting in Gaza,0.04075155035,Gaza,31.50161,34.46672,Gaza,31.50161,34.46672,City,,Lilia Edwards
UVA,UVA_4145,2025-03-26 22:18:50,I noticed that the protest being advertised is based on two specific demands: “Hands off Gaza” and the release of a visa student.,-0.2010761052,Gaza,31.50161,34.46672,Gaza,31.50161,34.46672,City,,Lilia Edwards
UVA,UVA_4459,2024-02-28 17:23:00,"im sorry but gaza should not be a big issues in america, if we cut all funding to israel, even non military they lose less than 10 percent of their military budget.",-0.6483291984,Gaza,31.50161,34.46672,Gaza,31.50161,34.46672,City,,Lilia Edwards
UVA,UVA_8286,2024-05-06 17:57:13,Send the fuckers to gaza,-0.9317526817,Gaza,31.50161,34.46672,Gaza,31.50161,34.46672,City,,Lilia Edwards
UVA,UVA_8858,2023-10-10 22:43:16,The only thing this does is give Isreali far right nationalists ammunition to fire bomb all of gaza,-0.6228088737,Gaza,31.50161,34.46672,Gaza,31.50161,34.46672,City,,Lilia Edwards
UVA,UVA_8878,2023-10-11 2:28:19,The Israeli army could kill everyone in Gaza tomorrow.,-0.9137662649,Gaza,31.50161,34.46672,Gaza,31.50161,34.46672,City,,Lilia Edwards
UVA,UVA_8901,2023-10-11 2:28:19,"And again, the charter of their government in Gaza explicitly tells us that they want to annihilate the Jews—not just in Israel but everywhere.""",-0.8038503528,Gaza,31.50161,34.46672,Gaza,31.50161,34.46672,City,,Lilia Edwards
UVA,UVA_8910,2023-10-11 0:20:03,Palestinian citizens in Gaza chortled and further desecrated their dead bodies that were transported in open trucks driven by exultant Hamas butchers on the Palestinian streets of the Gaza Strip.,-0.9281497002,Gaza,31.50161,34.46672,Gaza,31.50161,34.46672,City,,Lilia Edwards
UVA,UVA_8958,2023-10-19 9:08:44,It’s in everyone’s best interest to not take in any refugees from Gaza and give the quota to Latin American refugees,-0.1065010056,Gaza,31.50161,34.46672,Gaza,31.50161,34.46672,City,,Lilia Edwards
UVA,UVA_8996,2023-10-10 23:58:12,"What's happening to civilians in Israel and Gaza is a tragedy, but it's going to KEEP HAPPENING until either every man, woman, and child in Gaza and the West Bank is dead or we're going to have to find a two-state solution that actually protects the territorial integrity of Gaza and the West Bank.",-0.7009728551,Gaza,31.50161,34.46672,Gaza,31.50161,34.46672,City,,Lilia Edwards
UVA,UVA_8996,2023-10-10 23:58:12,"What's happening to civilians in Israel and Gaza is a tragedy, but it's going to KEEP HAPPENING until either every man, woman, and child in Gaza and the West Bank is dead or we're going to have to find a two-state solution that actually protects the territorial integrity of Gaza and the West Bank.",-0.7009728551,Gaza,31.50161,34.46672,Gaza,31.50161,34.46672,City,,Lilia Edwards
UVA,UVA_8996,2023-10-10 23:58:12,"What's happening to civilians in Israel and Gaza is a tragedy, but it's going to KEEP HAPPENING until either every man, woman, and child in Gaza and the West Bank is dead or we're going to have to find a two-state solution that actually protects the territorial integrity of Gaza and the West Bank.",-0.7009728551,Gaza,31.50161,34.46672,Gaza,31.50161,34.46672,City,,Lilia Edwards
UVA,UVA_2749,2020-08-04 12:34:41,14th Street bridge.,-0.008201202378,George Mason Memorial Bridge,38.8765,-77.04164,14th St,38.03749645,-78.49781412,Road,,Lilia Edwards
UVA,UVA_2771,2020-08-03 21:47:29,There was a bus that came down w main and turned on 14th.,-0.01223338395,George Mason Memorial Bridge,38.8765,-77.04164,14th St,38.03749645,-78.49781412,Road,,Lilia Edwards
UVA,UVA_7339,2024-03-13 10:50:44,"And be careful of these white savior girlies, their whole family is from goochland and got ties to the KKK and still supports BLM 🤝🤝🤝.",-0.4969466329,Goochland,37.68431,-77.88527,Goochland County,37.68431,-77.88527,County,,Lilia Edwards
UVA,UVA_6578,2025-05-23 10:31:49,"Albemarle County, Greene County, and Madison County need to step up law-enforcement big-time on route 29.",0.02534007095,Greene County,39.3562,-90.39049,Greene County,38.31204829,-78.45258035,County,,Lilia Edwards
UVA,UVA_6207,2025-07-21 18:40:00,"Cavalier Daily Editorial Board: ""As it stands, students will be returning to Grounds with no concrete sense of who will be at the helm of this institution and little reason to trust the governing body, which has made no attempt to explain or justify its actions.""",-0.6657500863,Grounds Building,40.82722,-96.69585,UVA,38.03348104,-78.50793429,University,,Lilia Edwards
UVA,UVA_8496,2020-09-17 14:17:52,"Every time I've gone past the field next to O-hill it's been swarmed with students, only about 30% of which are actively wearing masks",-0.05675068498,H O Hill,30.68431,-104.24353,Observatory Hill Dining Hall,38.03480732,-78.5152253,Building,,Lilia Edwards
UVA,UVA_2864,2025-06-28 17:47:52,Seen at 29 and Hydraulic today.,0.0005793953314,Haaga,60.22132,24.89759,US-29 & Hydraulic Rd,38.06184978,-78.4916274,Road,,Lilia Edwards
UVA,UVA_5885,2025-02-27 17:25:53,"Scanner has reported that the suspect ditched the sweater and is no longer wearing it, they found it in a trash can ETA: It was found behind Halsey Hall",-0.0720846802,Halsey Hall,41.66307,-91.53684,Halsey Hall,38.03295248,-78.50701729,Building,,Lilia Edwards
UVA,UVA_2480,2023-11-30 17:15:25,"They were quite rude as we were walking past them to get into the stadium (booing, saying go back to Harrisonburg, etc…).",-0.7958599329,Harrisonburg,38.44957,-78.86892,Harrisonburg,38.44957,-78.86892,City,,Lilia Edwards
UVA,UVA_756,2021-05-08 22:32:17,"So far, the exterior areas currently constructed are the Rotunda, The Lawn (Pavilions I-IX and Pavilions II-X), West Range (Dining Hall, Lawn Rooms, and Hotels), the Chapel, Alderman Library, Clemons Library, Special Collections, Peabody Hall, Monroe Hall, Garrett Hall, Cocke Hall, Old Cabell Hall, New Cabell Hall, Rouss Hall, Bryan Hall, and McIntire Amphitheatre.",0.001775119919,Harry C Clemons Library,38.03639,-78.50611,Clemons Library,38.03635515,-78.50626167,Building,,Lilia Edwards
UVA,UVA_2079,2024-05-05 16:28:34,"Do you remember the Munich Olympics (of course you don’t) do you remember the Islamic revolution, did you know its in Iran’s legal code to kill every last Jew in the world and eradicate Israel, did you know that Israel didn’t ask Arabs or Palestinians to leave n 1947 but instead invited them to stay only to be attacked by them, did you know that the 7 day war was started by the Arab nations, did you know that Egypt and Jordan have peace treaties with Israel.",-0.4765244424,Hashemite Kingdom of Jordan,31,36,Jordan,31.14009667,36.72221814,Country,,Lilia Edwards
UVA,UVA_4642,2025-09-12 23:12:16,I’m assuming you’re not from downtown Richmond… You are Henrico or Chesterfield?,-0.01924911886,Henrico County,37.45771,-77.29646,Henrico County,37.45771,-77.29646,County,,Lilia Edwards
UVA,UVA_8209,2024-10-06 22:22:15,The Hill environment was the only unique thing about the games.,0.6490474939,Hill,36.70788,-82.64794,Scott Stadium,38.03170358,-78.51442447,Building,,Lilia Edwards
UVA,UVA_5649,2025-10-10 0:49:16,You could try to apply to the USPTO (Alexandria VA) once you have the ability to show up/look presentable.,0.0680174455,Homewod Suites By Hilton Alexandria Va,38.84456,-77.11186,"United States Patent and Trademark Office",38.80211327,-77.06421021,Building,,Lilia Edwards
UVA,UVA_6202,2024-11-20 9:00:26,Go to Honolulu.,0.005198795814,Honolulu,21.30694,-157.85833,Honolulu,21.30368318,-157.858068,City,,Lilia Edwards
UVA,UVA_2864,2025-06-28 17:47:52,Seen at 29 and Hydraulic today.,0.0005793953314,Hydraulic,52.61657,-121.70276,US-29 & Hydraulic Rd,38.06184978,-78.4916274,Road,,Lilia Edwards
UVA,UVA_7324,2024-03-13 6:48:58,Go check out the center median at Hydraulic and 250.,-0.002464851132,Hydraulic,52.61657,-121.70276,US-250 & Hydraulic Rd,38.05680547,-78.4894555,Road,,Lilia Edwards
UVA,UVA_8473,2020-11-07 21:25:58,https://github.com/cjph8914/2020_benfords This is analysis that shows solid evidence of ballot count tampering in Illinois and Wisconsin.,-0.06110817194,Illinois,40.00032,-89.25037,,,,,,
UVA,UVA_7198,2023-11-27 16:17:30,"Besides, we need a new school that's great at basketball but bad at football, because Indiana is starting to be not so great at basketball either.",-0.4046891928,Indiana,40.00032,-86.25027,,,,,,
UVA,UVA_9770,2022-12-07 19:31:59,"They've beaten Baylor, Indiana and Michigan while the women's only quality win is Penn State.",0.1468147486,Indiana,40.00032,-86.25027,,,,,,
UVA,UVA_10154,2023-03-17 23:44:25,"I lived in Indianapolis for 10 years, Purdue fans were among the most arrogant and obnoxious fan bases I’ve ever seen, so I certainly wasn’t upset at all to see them get knocked out by a 16 seed!",-0.3399769962,Indianapolis,39.76838,-86.15804,,,,,,
UVA,UVA_2025,2024-05-05 13:27:06,"You might be in favor of this happy lala land, but Hamas, Iran, Syria, Hezbolah, etc are not.",-0.2312108278,Islamic Republic of Iran,32,53,Iran,32.07062321,54.17903616,Country,,Madison Fernandez
UVA,UVA_2073,2024-05-05 16:12:28,"On the other hand, Hamas and the Palestinian authority and Iran actually have it in their charters, written into the public record and on the books that they won’t stop until Israel has been eradicated.",-0.3329508007,Islamic Republic of Iran,32,53,Iran,32.07062321,54.17903616,Country,,Madison Fernandez
UVA,UVA_2079,2024-05-05 16:28:34,"Do you remember the Munich Olympics (of course you don’t) do you remember the Islamic revolution, did you know its in Iran’s legal code to kill every last Jew in the world and eradicate Israel, did you know that Israel didn’t ask Arabs or Palestinians to leave n 1947 but instead invited them to stay only to be attacked by them, did you know that the 7 day war was started by the Arab nations, did you know that Egypt and Jordan have peace treaties with Israel.",-0.4765244424,Islamic Republic of Iran,32,53,Iran,32.07062321,54.17903616,Country,,Madison Fernandez
UVA,UVA_2080,2024-05-05 16:28:34,Did you know that October 7th was Hamas’ and Iran’s effort to undermine the Saudi peace treaty?,-0.2683860958,Islamic Republic of Iran,32,53,Iran,32.07062321,54.17903616,Country,,Madison Fernandez
UVA,UVA_2100,2024-05-06 16:45:57,Why is it only Iran and it’s proxies are supporting the Palestinians?,-0.5518011451,Islamic Republic of Iran,32,53,Iran,32.07062321,54.17903616,Country,,Madison Fernandez
UVA,UVA_8273,2024-05-06 16:48:10,Why is it only Iran and it’s proxies are supporting the Palestinians?,-0.5518011451,Islamic Republic of Iran,32,53,Iran,32.07062321,54.17903616,Country,,Madison Fernandez
UVA,UVA_6052,2020-11-06 13:58:51,Albino deer seen off JPA,-0.01218527462,João Pessoa,-7.115,-34.86306,,,,,,
UVA,UVA_6058,2020-11-06 18:37:12,i’ve also seen this deer living off of JPA!,0.0007262849249,João Pessoa,-7.115,-34.86306,,,,,,
