school_name,unique_id,date,sentences,roberta_compound,place,latitude,longitude,revised_place,revised_latitude,revised_longitude,place_type,false_positive,checked_by
UVA,UVA_1298,2025-03-31 22:26:05,"It’s like saying, “America is good enough for me to benefit from, but not good enough for me to respect.” Please explain to me how her advocating for peace in Palestine is ""Disrespectful to American culture.""",-0.665990293,Palestine,31.92157,35.20329,Palestine,31.92157,35.20329,Country,,Lilia Edwards
UVA,UVA_1314,2025-03-31 22:26:05,The main issue in question should be a concern for all Americans regardless of where you stand on Palestine or Israel.,-0.02604249306,Palestine,31.92157,35.20329,Palestine,31.92157,35.20329,Country,,Lilia Edwards
UVA,UVA_2088,2024-05-05 22:05:52,Free Palestine from the barbaric Zionists.,-0.7760602832,Palestine,31.92157,35.20329,Palestine,31.92157,35.20329,Country,,Lilia Edwards
UVA,UVA_2241,2024-05-07 8:36:07,"Especially since Palestine started this...""no we didn't hamas did"" but when they started it you guys were in the streets yelling kill the Jews.",-0.6744644046,Palestine,31.92157,35.20329,Palestine,31.92157,35.20329,Country,,Lilia Edwards
UVA,UVA_4130,2025-03-26 16:08:09,"Free Palestine, Free Turtle Island, Free those kept in the ICE concentration camps!",-0.4395187795,Palestine,31.92157,35.20329,Palestine,31.92157,35.20329,Country,,Lilia Edwards
UVA,UVA_4205,2025-03-30 8:59:15,Gays for Palestine!,0.09643805772,Palestine,31.92157,35.20329,Palestine,31.92157,35.20329,Country,,Lilia Edwards
UVA,UVA_4354,2024-02-27 0:51:20,UVA Professor supports Palestine by cancelling class https://mynbc15.com/amp/news/nation-world/university-of-virginia-uva-jewish-students-parents-antisemitism-islamophobia-divest-students-protest-discrimination-october-7-us-department-of-education-pro-palestine-groups-israel-gaza-hamas-war,-0.1461247206,Palestine,31.92157,35.20329,Palestine,31.92157,35.20329,Country,,Lilia Edwards
UVA,UVA_4397,2024-02-27 9:01:22,"Without offering any opinion on the Palestine issue, there is more to education than class lectures.",-0.1419995129,Palestine,31.92157,35.20329,Palestine,31.92157,35.20329,Country,,Lilia Edwards
UVA,UVA_4447,2024-02-27 11:48:06,"Cancelling class to support either side of a political agenda (and same as you, without offering an opinion on the Palestine issue) is undermining the core purpose of the students even being there, in my eyes.",-0.6723740101,Palestine,31.92157,35.20329,Palestine,31.92157,35.20329,Country,,Lilia Edwards
UVA,UVA_7004,2024-02-26 11:27:54,"As a Chinese international student, I believe there is no problem with supporting Palestine or free Palestine, and actually it should.",0.3923598826,Palestine,31.92157,35.20329,Palestine,31.92157,35.20329,Country,,Lilia Edwards
UVA,UVA_7004,2024-02-26 11:27:54,"As a Chinese international student, I believe there is no problem with supporting Palestine or free Palestine, and actually it should.",0.3923598826,Palestine,31.92157,35.20329,Palestine,31.92157,35.20329,Country,,Lilia Edwards
UVA,UVA_7011,2024-02-29 19:41:58,Free Palestine,-0.01862403005,Palestine,31.92157,35.20329,Palestine,31.92157,35.20329,Country,,Lilia Edwards
UVA,UVA_7038,2024-02-26 7:26:53,"I don’t mind that the group supports Palestine, but getting behind SJP in particular?",-0.1331356913,Palestine,31.92157,35.20329,Palestine,31.92157,35.20329,Country,,Lilia Edwards
UVA,UVA_8318,2024-05-07 11:34:37,Fuck Palestine,-0.8988016248,Palestine,31.92157,35.20329,Palestine,31.92157,35.20329,Country,,Lilia Edwards
UVA,UVA_8814,2023-10-10 21:26:52,"UVA student club endorses murders in Israel, says they are ""a step towards a free Palestine"".",-0.5108777881,Palestine,31.92157,35.20329,Palestine,31.92157,35.20329,Country,,Lilia Edwards
UVA,UVA_8817,2023-10-10 21:31:40,"They say that events over the last two days make them hopeful for the future of Palestine, but this will only cause more death to Israelis and Palestinians.",-0.818177104,Palestine,31.92157,35.20329,Palestine,31.92157,35.20329,Country,,Lilia Edwards
UVA,UVA_8824,2023-10-11 10:50:02,"Murdering Israelis doesn't = a ""free Palestine.""",-0.6738592386,Palestine,31.92157,35.20329,Palestine,31.92157,35.20329,Country,,Lilia Edwards
UVA,UVA_8951,2023-10-10 22:17:26,"Terrorists, they should be sent to palestine",-0.8778256178,Palestine,31.92157,35.20329,Palestine,31.92157,35.20329,Country,,Lilia Edwards
UVA,UVA_8965,2023-10-14 7:01:49,It is important to separate people like this who support hamas and those who support a free palestine and an end to military occupation.,-0.116185911,Palestine,31.92157,35.20329,Palestine,31.92157,35.20329,Country,,Lilia Edwards
UVA,UVA_8969,2023-10-10 23:04:36,Hamas has likely brought destruction on all of Palestine and have no one to blame but themselves.,-0.8915885091,Palestine,31.92157,35.20329,Palestine,31.92157,35.20329,Country,,Lilia Edwards
UVA,UVA_9689,2025-06-01 12:23:13,I am still very upset about his handling of the Palestine protest but he’s certainly better than whatever psycho the Jefferson Council would want instrad,-0.3059378564,Palestine,31.92157,35.20329,Palestine,31.92157,35.20329,Country,,Lilia Edwards
UVA,UVA_11012,2025-03-28 1:39:21,saying this but they sicd the state police on students in patagonia tents lmao,-0.4437735677,Patagonia,-44,-68,,,,,,
UVA,UVA_756,2021-05-08 22:32:17,"So far, the exterior areas currently constructed are the Rotunda, The Lawn (Pavilions I-IX and Pavilions II-X), West Range (Dining Hall, Lawn Rooms, and Hotels), the Chapel, Alderman Library, Clemons Library, Special Collections, Peabody Hall, Monroe Hall, Garrett Hall, Cocke Hall, Old Cabell Hall, New Cabell Hall, Rouss Hall, Bryan Hall, and McIntire Amphitheatre.",0.001775119919,Peabody Hall,33.95484,-83.37349,Peabody Hall,38.03562495,-78.50626535,Building,,Lilia Edwards
UVA,UVA_11152,2024-03-18 23:40:58,I know that’s a thing in PA and may be called something different in VA.,-0.01258411072,Pennsylvania,40.8,-77.7,Pennsylvania,40.8,-77.7,State,,Lilia Edwards
UVA,UVA_5191,2020-05-24 5:53:46,"I've never rented from Penske, but most places will absolutely fuck you for damage like this",-0.9194225073,Penske Heliport,40.33259,-75.93604,Penske Truck Rental,38.07163007,-78.48207147,Building,,Lilia Edwards
UVA,UVA_1686,2025-06-26 20:15:03,Republicans are really making America more and more like China every day.,-0.116077587,People’s Republic of China,35,105,China,34.00899166,103.4826481,Country,,Lilia Edwards
UVA,UVA_6971,2024-02-26 4:10:09,"Simultaneously, we have witnessed the past and current administration become increasingly hostile toward China, stoking sinophobic, inflammatory narratives about COVID-19 and escalating military expansion and action to 'counter China' through warmongering rhetoric and demonization of nations abroad.",-0.7031503916,People’s Republic of China,35,105,China,34.00899166,103.4826481,Country,,Lilia Edwards
UVA,UVA_6971,2024-02-26 4:10:09,"Simultaneously, we have witnessed the past and current administration become increasingly hostile toward China, stoking sinophobic, inflammatory narratives about COVID-19 and escalating military expansion and action to 'counter China' through warmongering rhetoric and demonization of nations abroad.",-0.7031503916,People’s Republic of China,35,105,China,34.00899166,103.4826481,Country,,Lilia Edwards
UVA,UVA_7008,2024-02-26 11:27:54,"So it is really important for UVA to check whether this organization received funding from CCP, just like Codepink organization, which shouted by Nancy Pelosi to go back China.",-0.03442517295,People’s Republic of China,35,105,China,34.00899166,103.4826481,Country,,Lilia Edwards
UVA,UVA_7017,2024-02-29 22:17:20,"You seem to be more closely connected to the US military, so it would make sense that you aren't too happy to hear that ASU is protesting against the genocidal acts of a US ally, but I am surprised that you are resistant to the claims to Sinophobia regarding the American stance towards China.",-0.478666544,People’s Republic of China,35,105,China,34.00899166,103.4826481,Country,,Lilia Edwards
UVA,UVA_7018,2024-02-29 22:17:20,"It isn't necessarily that Joe Biden and the military's posturing towards China is sinophobic in itself, but the rhetoric that they have allowed to spread does, to some degree, carry anti-Chinese sentiment.",-0.552312851,People’s Republic of China,35,105,China,34.00899166,103.4826481,Country,,Lilia Edwards
UVA,UVA_7037,2024-02-26 7:26:53,"I really don’t think their support of China is anything beyond “Asian = good and any criticism is racism.” It’s a silly and reductive argument, especially when China is guilty of many of the criticisms that they say the US has.",-0.6623820066,People’s Republic of China,35,105,China,34.00899166,103.4826481,Country,,Lilia Edwards
UVA,UVA_7037,2024-02-26 7:26:53,"I really don’t think their support of China is anything beyond “Asian = good and any criticism is racism.” It’s a silly and reductive argument, especially when China is guilty of many of the criticisms that they say the US has.",-0.6623820066,People’s Republic of China,35,105,China,34.00899166,103.4826481,Country,,Lilia Edwards
UVA,UVA_7046,2024-02-26 14:07:10,"These countries also push propaganda on this(Russia/USSR is well documented as pushing Anti-Imperialist propaganda on these groups, or China has historically used being a victim of colonizing as an excuse despite being a colonizer too) to bolster these claims.",-0.3709001839,People’s Republic of China,35,105,China,34.00899166,103.4826481,Country,,Lilia Edwards
UVA,UVA_7069,2024-03-01 14:28:57,no amount of self-flagellating over China will make you white.,-0.4652198851,People’s Republic of China,35,105,China,34.00899166,103.4826481,Country,,Lilia Edwards
UVA,UVA_7071,2024-03-01 14:28:57,so hating on China is actually doing a disservice to all of us...,-0.8695517182,People’s Republic of China,35,105,China,34.00899166,103.4826481,Country,,Lilia Edwards
UVA,UVA_7085,2024-02-26 9:41:22,"Whoops, sorry about the whole China good west bad thing they had going",-0.6851093173,People’s Republic of China,35,105,China,34.00899166,103.4826481,Country,,Lilia Edwards
UVA,UVA_10495,2020-12-27 4:09:01,"The American media says a lot of terrible things about China, and so does the Chinese media on America.",-0.8871770501,People’s Republic of China,35,105,China,34.00899166,103.4826481,Country,,Lilia Edwards
UVA,UVA_10515,2020-12-27 10:47:30,But I never felt this lonely when I was in China.,-0.2799042165,People’s Republic of China,35,105,China,34.00899166,103.4826481,Country,,Lilia Edwards
UVA,UVA_10545,2020-12-27 16:04:08,What is the relationship like between international students from China and first or second generation Chinese-American students?,-0.005937649868,People’s Republic of China,35,105,China,34.00899166,103.4826481,Country,,Lilia Edwards
UVA,UVA_10577,2020-12-27 13:30:35,"This rarely occurs in China, and these friends say that is one of the things they learned to like best about America.",0.0917950049,People’s Republic of China,35,105,China,34.00899166,103.4826481,Country,,Lilia Edwards
UVA,UVA_6614,2022-11-14 12:07:27,Panthers sending love from Pittsburgh!,0.9243555665,Pittsburgh,40.44062,-79.99589,Pittsburgh,40.44062,-79.99589,City,,Lilia Edwards
UVA,UVA_11269,2020-08-19 16:43:53,"Ah, a fellow town of Salem player, love the username",0.9561454058,Pole Tavern,39.61678,-75.22907,Salem,42.51357507,-70.89688022,City,,Lilia Edwards
UVA,UVA_11319,2025-04-16 16:06:07,What about Regent University in VB?,-0.000548413489,Provincia Verbano-Cusio-Ossola,45.93333,8.55,Regent Univeristy,36.80071255,-76.19292709,University,,Lilia Edwards
UVA,UVA_5733,2025-06-28 11:42:40,"He couldn’t make it as a VC in Silicone Valley, he did manage to get up in Thiels ass",-0.2085425705,Quality Inn & Suties Silicone Valley,37.35214,-121.97977,Silicone Valley,37.38598034,-122.0631394,City,,Lilia Edwards
UVA,UVA_8957,2023-10-19 9:08:44,"This is when we literally deport thousands of people a year from Honduras/Cuba, who will suffer violence when they go home.",-0.8388636112,Republic of Honduras,15,-86.5,Honduras,14.73127516,-86.96235652,Country,,Lilia Edwards
UVA,UVA_8739,2025-03-21 9:27:35,I got into UVA as an international student from India in RD.,0.002623753157,Republic of India,22,79,India,22.31106178,79.35308695,Country,,Lilia Edwards
UVA,UVA_5721,2025-06-28 12:17:03,"In 2021, JD Vance also called for the ""de-Baathification"" of America's public institutions, referring to the policy of purging the Ba'ath Party's influence after the invasion of Iraq and toppling of Saddam Hussein - *""We should seize the institutions of the left and turn them against the left.",-0.1019558758,Republic of Iraq,33,44,Iraq,33.18243828,42.39862979,Country,,Lilia Edwards
UVA,UVA_10441,2020-11-03 2:04:26,Borat: Desperate Search for Wife with Tight Vagene for Permanent Residency in America to Somehow Make Benefit Now Unemployed Nation of Kazakhstan,-0.0249109976,Republic of Kazakhstan,48,68,Kazakhstan,48,68,Country,,Lilia Edwards
UVA,UVA_5736,2025-06-28 11:54:26,"* [https://www.newyorker.com/magazine/2025/06/09/curtis-yarvin-profile](https://www.newyorker.com/magazine/2025/06/09/curtis-yarvin-profile) Yarvin proposes that nations should eventually be broken up into a “patchwork” of statelets, like Singapore or Dubai, each with its own sovereign ruler.",-0.01487353072,Republic of Singapore,1.36667,103.8,Singapore,1.36667,103.8,Country,,Lilia Edwards
UVA,UVA_2097,2024-05-06 14:42:48,"More than 150,000 people have been killed in Yemen as well as estimates of more than 227,000 dead as a result of an ongoing famine and lack of healthcare facilities due to the war Ethnic killings in one Sudan city left up to 15,000 dead.",-0.9101796746,Republic of the Sudan,16,30,Sudan,16,30,Country,,Lilia Edwards
UVA,UVA_2097,2024-05-06 14:42:48,"More than 150,000 people have been killed in Yemen as well as estimates of more than 227,000 dead as a result of an ongoing famine and lack of healthcare facilities due to the war Ethnic killings in one Sudan city left up to 15,000 dead.",-0.9101796746,Republic of Yemen,15.5,47.5,Yemen,15.5,47.5,Country,,Lilia Edwards
UVA,UVA_12213,2020-02-04 19:30:02,5th floor of Rice,-0.01174933836,Rice,49.8667,-95.08378,Rice Hall,38.03166525,-78.51097465,Building,,Lilia Edwards
UVA,UVA_5929,2025-02-27 17:14:18,Near RICE HALL now,0.002904849127,Rice Hall,40.92843,-73.78374,Rice Hall,38.03166525,-78.51097465,Building,,Lilia Edwards
UVA,UVA_12208,2020-02-04 19:03:57,Time lapse from the top of Rice Hall,0.00704944646,Rice Hall,40.92843,-73.78374,Rice Hall,38.03166525,-78.51097465,Building,,Lilia Edwards
UVA,UVA_301,2025-06-28 8:18:25,"I understand his selfless reasoning, but I truly resent the heavy handed bullying from the republicans in Washington and Richmond in forcing his departure.",-0.7895032763,Richmond,37.55376,-77.46026,"Richmond, VA",37.54066835,-77.43632394,City,,Madison Fernandez
UVA,UVA_4586,2025-09-12 1:18:47,You need to get out of your own bubble of Richmond and stop generalizing everyone from a single region.,-0.3594168425,Richmond,37.55376,-77.46026,"Richmond, VA",37.54066835,-77.43632394,City,,Madison Fernandez
UVA,UVA_4641,2025-09-12 23:12:16,I see no difference between kids from Richmond suburbs and Northern Virginia.,-0.2168089449,Richmond,37.55376,-77.46026,"Richmond, VA",37.54066835,-77.43632394,City,,Madison Fernandez
UVA,UVA_4642,2025-09-12 23:12:16,I’m assuming you’re not from downtown Richmond… You are Henrico or Chesterfield?,-0.01924911886,Richmond,37.55376,-77.46026,"Richmond, VA",37.54066835,-77.43632394,City,,Madison Fernandez
UVA,UVA_8642,2019-04-06 21:28:00,I watched at Kickback Jack's in southside Richmond.,0.02212087251,Richmond,37.55376,-77.46026,"Richmond, VA",37.54066835,-77.43632394,City,,Madison Fernandez
UVA,UVA_3923,2025-03-29 10:38:28,Richmond area here.,0.004480488133,Richmond County,33.35963,-82.07355,"Richmond, VA",37.54066835,-77.43632394,City,,Madison Fernandez
UVA,UVA_1803,2021-12-17 19:44:51,"I shot three panels to get the entire Rotunda, trees, and sky section and then constructed a mosaic of the ground in Photoshop.",0.002986412495,Rotonda,39.9527,16.03908,The Rotunda,38.03566061,-78.50343889,Building,,Madison Fernandez
UVA,UVA_756,2021-05-08 22:32:17,"So far, the exterior areas currently constructed are the Rotunda, The Lawn (Pavilions I-IX and Pavilions II-X), West Range (Dining Hall, Lawn Rooms, and Hotels), the Chapel, Alderman Library, Clemons Library, Special Collections, Peabody Hall, Monroe Hall, Garrett Hall, Cocke Hall, Old Cabell Hall, New Cabell Hall, Rouss Hall, Bryan Hall, and McIntire Amphitheatre.",0.001775119919,Rotunda,38.03569,-78.50362,The Rotunda,38.03566061,-78.50343889,Building,,Madison Fernandez
UVA,UVA_757,2021-05-08 22:32:17,I haven't been able to build many interiors for buildings other than the Rotunda unfortunately due to time constraints.,-0.7313944101,Rotunda,43.98333,24.31667,The Rotunda,38.03566061,-78.50343889,Building,,Madison Fernandez
UVA,UVA_852,2024-08-30 21:15:24,"The Rotunda is a UNESCO world Heritage Site, meaning it has relevance.",0.6581204534,Rotunda,43.98333,24.31667,The Rotunda,38.03566061,-78.50343889,Building,,Madison Fernandez
UVA,UVA_1738,2025-06-27 12:11:45,I believe there is a protest planned for today at 3PM at the Rotunda.,-0.07854796201,Rotunda,43.98333,24.31667,The Rotunda,38.03566061,-78.50343889,Building,,Madison Fernandez
UVA,UVA_1779,2021-12-15 9:39:33,I spent three nights capturing the Heart and Soul Nebulae over the Rotunda,0.02030535787,Rotunda,43.98333,24.31667,The Rotunda,38.03566061,-78.50343889,Building,,Madison Fernandez
UVA,UVA_4056,2022-09-08 15:12:51,Queen Elizabeth walks the Lawn before dinner at the Rotunda in 1976,0.001056710025,Rotunda,43.98333,24.31667,The Rotunda,38.03566061,-78.50343889,Building,,Madison Fernandez
UVA,UVA_4066,2022-09-08 15:14:29,"Accessing the Rotunda roof through a trap door, Bice glued white butcher paper to the oculus to block the sunlight.",-0.02379147895,Rotunda,43.98333,24.31667,The Rotunda,38.03566061,-78.50343889,Building,,Madison Fernandez
UVA,UVA_4075,2024-03-04 7:12:31,"When I was a first year in 90, we had a dinner event in the Rotunda for our dorm and Bice was the speaker.",0.01019582711,Rotunda,43.98333,24.31667,The Rotunda,38.03566061,-78.50343889,Building,,Madison Fernandez
UVA,UVA_4325,2020-03-31 21:42:59,Nice you got the weather right for the Rotunda as well,0.887196064,Rotunda,43.98333,24.31667,The Rotunda,38.03566061,-78.50343889,Building,,Madison Fernandez
UVA,UVA_4336,2020-03-31 22:14:46,"I haven’t gotten to the interior yet :( I have only visited the Rotunda in person a handful of times, and have a very vague idea of what it looks like.",-0.5199247003,Rotunda,43.98333,24.31667,The Rotunda,38.03566061,-78.50343889,Building,,Madison Fernandez
UVA,UVA_4465,2022-09-03 11:07:36,"The second image I shot last year, and is of the Heart and Soul Nebula over the Rotunda.",0.00449306611,Rotunda,43.98333,24.31667,The Rotunda,38.03566061,-78.50343889,Building,,Madison Fernandez
UVA,UVA_6017,2020-04-06 18:10:53,"Thought I’d update you all now that I finalized the Rotunda design, and installed a shader mod.",0.04796436056,Rotunda,43.98333,24.31667,The Rotunda,38.03566061,-78.50343889,Building,,Madison Fernandez
UVA,UVA_6022,2020-04-06 18:24:12,I tried to make a Rotunda design myself and just got tired before I finished lol.,-0.2508796453,Rotunda,43.98333,24.31667,The Rotunda,38.03566061,-78.50343889,Building,,Madison Fernandez
UVA,UVA_6049,2020-04-07 22:45:17,You’re not the first to do the Rotunda MC but this is definitely one of the better efforts I’ve seen.,0.9508607388,Rotunda,43.98333,24.31667,The Rotunda,38.03566061,-78.50343889,Building,,Madison Fernandez
UVA,UVA_6554,2021-04-18 0:13:18,It’s from University Avenue side of the Rotunda.,0.003332448425,Rotunda,43.98333,24.31667,The Rotunda,38.03566061,-78.50343889,Building,,Madison Fernandez
UVA,UVA_9275,2022-02-06 11:24:10,Procrastinating by creating the Rotunda on the Sims >>>,0.02001740597,Rotunda,43.98333,24.31667,The Rotunda,38.03566061,-78.50343889,Building,,Madison Fernandez
UVA,UVA_9535,2025-10-22 10:03:27,"The Rotunda is the old UVA library -- before Alderman, before Clemons, before the annex that Echols burned down.",-0.02600971423,Rotunda,38.03569,-78.50362,The Rotunda,38.03566061,-78.50343889,Building,,Madison Fernandez
UVA,UVA_9540,2025-10-22 10:03:27,I expect someone said something similar when they moved the books out of the Rotunda.,-0.02353802882,Rotunda,43.98333,24.31667,The Rotunda,38.03566061,-78.50343889,Building,,Madison Fernandez
UVA,UVA_9789,2021-04-19 16:49:09,Makes me sick when I see it on the steps of the Rotunda.,-0.9008824825,Rotunda,43.98333,24.31667,The Rotunda,38.03566061,-78.50343889,Building,,Madison Fernandez
UVA,UVA_9791,2021-04-19 21:35:51,"Taking the 1895 fire and Stanford White’s additions into consideration, there are some secret societies older than even the Rotunda and Southern Lawn.",-0.002440270968,Rotunda,38.03569,-78.50362,The Rotunda,38.03566061,-78.50343889,Building,,Madison Fernandez
UVA,UVA_9824,2025-10-17 11:25:06,There’s a rally at noon today at the Rotunda,0.01203218009,Rotunda,43.98333,24.31667,The Rotunda,38.03566061,-78.50343889,Building,,Madison Fernandez
UVA,UVA_11582,2025-10-16 23:52:24,"""News conference at 11:15 a.m., followed by a rally starting at the Rotunda at noon.",0.01021176949,Rotunda,43.98333,24.31667,The Rotunda,38.03566061,-78.50343889,Building,,Madison Fernandez
UVA,UVA_826,2024-08-30 12:40:35,"Extend it out to have the Lawn, Academical Village, Homer Statue, Rouss, Cocke, and Old Cabell.",0.005667147692,Rouss,47.40027,8.87598,,,,,,
UVA,UVA_11270,2021-03-23 12:24:06,Please be careful if you decide to drive south I realize that a lot of students are headed south on Rt.,-0.08119124174,Rt,51.1596,-115.569,,,,,,
UVA,UVA_1300,2025-03-31 22:26:05,Recently the Trump administration has become more and more comfortable with siding with Russia.,-0.09524591267,Russian Federation,60,100,,,,,,
UVA,UVA_1302,2025-03-31 22:26:05,Do you believe they deserve to be mistreated and deported for believing that Russia shouldn't be attacking Ukraine?,-0.7030287981,Russian Federation,60,100,,,,,,
UVA,UVA_2099,2024-05-06 14:42:48,"Russia’s invasion of Ukraine resulted in at least 82,000 deaths in 2022, Ethiopia — over 104,000 — in that conflict between the national government and regional forces in Tigray",-0.7974073887,Russian Federation,60,100,,,,,,
UVA,UVA_7007,2024-02-26 11:27:54,"Also I believe the US shouldn't be soft with CCP or Russia, which this ASU organization clearly advocate for.",-0.2270274013,Russian Federation,60,100,,,,,,
UVA,UVA_4323,2020-03-31 20:54:02,I have plans to fully reconstruct the Lawn and some of the neighboring buildings such as Old Cabell and the Pavilions.,0.02359254099,Sahara Pavilions,44.82625,14.7467,,,,,,
UVA,UVA_6018,2020-04-06 18:10:53,"Working on the Pavilions and will eventually work on Cocke, Old Cabell, and McIntire.",0.007143466733,Sahara Pavilions,44.82625,14.7467,,,,,,
UVA,UVA_9028,2019-04-17 16:10:34,Those companies are using Reddit’s conversations in the development of giant artificial intelligence systems that many in Silicon Valley think are on their way to becoming the tech industry’s next big thing.,0.4349960089,Santa Clara Valley,37.24883,-121.83995,,,,,,
UVA,UVA_9040,2019-04-17 21:22:34,Those companies are using Reddit’s conversations in the development of giant artificial intelligence systems that many in Silicon Valley think are on their way to becoming the tech industry’s next big thing.,0.4349960089,Santa Clara Valley,37.24883,-121.83995,,,,,,
UVA,UVA_10220,2024-04-26 17:08:49,There are memorial plaques at Scott.,0.002211024752,Scott County,36.42854,-84.50352,Scott Stadium,38.03130599,-78.51370936,Building,,Kayli Blankenship
UVA,UVA_4274,2025-10-19 7:56:06,Scott Stadium helped in this win Go Hoos,0.7898410559,Scott Stadium,38.03097,-78.51335,Scott Stadium,38.03130599,-78.51370936,Building,,Kayli Blankenship
UVA,UVA_4295,2025-10-19 0:39:04,"Maybe an unpopular opinion but comparatively speaking to other ACC stadiums, Scott Stadium is a mess.",-0.7241184115,Scott Stadium,38.03097,-78.51335,Scott Stadium,38.03130599,-78.51370936,Building,,Kayli Blankenship
UVA,UVA_6814,2025-10-19 11:55:49,"From Sabre the horse, to the cavalier marching band, to the lights and music, to the game and fans itself… the energy and atmosphere at Scott Stadium was alive and well!",0.8791005611,Scott Stadium,38.03097,-78.51335,Scott Stadium,38.03130599,-78.51370936,Building,,Kayli Blankenship
UVA,UVA_8130,2024-10-07 11:58:53,A noon game at Scott Stadium means it's blazing hot in the student section and they look into the sun the entire time.,0.468657583,Scott Stadium,38.03097,-78.51335,Scott Stadium,38.03130599,-78.51370936,Building,,Kayli Blankenship
UVA,UVA_9805,2021-04-20 19:26:41,"and townie, I hope you’ve joined the community at Lighting of the Lawn and seen the secret society’s symbols placed strategically around the Lawn in lights, or the student hillside at Scott Stadium where they’re set in stone.",0.09688530117,Scott Stadium,38.03097,-78.51335,Scott Stadium,38.03130599,-78.51370936,Building,,Kayli Blankenship
UVA,UVA_11562,2020-10-21 8:56:09,Imagine no chemistry building/gilmer and being able to see Scott Stadium from old dorms,-0.07610009611,Scott Stadium,38.03097,-78.51335,Scott Stadium,38.03130599,-78.51370936,Building,,Kayli Blankenship
UVA,UVA_6615,2022-11-14 12:51:31,UW Huskies sending love from Seattle,0.7169526815,Seattle,47.60621,-122.33207,Seattle,47.60535638,-122.3329462,City,,Kayli Blankenship
